url,title,date,imageurl,description,autokwd,company,screenshot,tag,platform
https://store.nintendo.co.kr/70010000086037,Tintin Reporter - Cigars of the Pharaoh,2024-10-17,https://store.nintendo.co.kr/media/catalog/product/cache/a7267a3b8c99c74f0bde248fd00edb94/a/7/a7521647777828db9115d167c80b1ec0d78686f9eec05a76142341003978e258.jpg,"예약구입 상품입니다.

Tintin과 Snowy를 따라 이들의 유명한 모험을 함께하세요.
Tintin과 그의 충직한 파트너 Snowy가 비범한 모험을 떠납니다... 지중해를 여행하다 Professor Sarcophagus를 만난 이 유명한 기자 콤비는, 파라오 키오스크의 무덤을 찾아 나서기로 합니다.
이 무덤에는 어떤 어두운 비밀이 숨어있을까요?
이집트와 인도, 아라비아를 거쳐 여행하던, Tintin과 Snowy는 동양 전역에 걸친 거대한 마약 밀매 네트워크를 발견하고 조사하게 됩니다.

원작에 충실한 다채로운 모험
- 이 게임은 Hergé의 번득이는 독창성이 그려낸 Tintin의 풍성한 세계관과 정교하고 흥미진진한 이야기를 배경으로, 신비로운 이집트와 끝없는 아름다움을 자랑하는 다양한 지역으로 여러분을 초대합니다. “Cigars of the Pharaoh”는 시리즈의 네 번째 모험입니다.

생생한 모험으로 가득한 게임
- Tintin과 함께 액션이 넘치고 머리도 써야 하는 스테이지에 뛰어들어, 국제적인 마약 밀매 사건을 해결하세요. 동양을 탐험하고, 무덤과 광활한 사막, 초목이 우거진 정글 등 온갖 위험이 도사린 장소를 모험하세요.

도전 정신을 불러일으키는 다양한 게임플레이
- 어드벤처와 수사 장르 게임의 최고 요소만을 조합한 독특하고 혁신적인 게임플레이를 즐겨보세요. 탐정이나 기자의 모습으로 변신하세요. 주변을 탐색하며, 잠입하여 단서를 찾고, 미려한 컷신으로 풍성하게 구성한 탐문 조사를 통해 퍼즐을 해결하세요.
- 수수께끼, 탐색 또는 잠입 구간, 비행기 및 자동차 추격적, 탐문 조사 등, 모두에게 진정한 기자가 된 듯한 모험을 선사하는 독특하고 혁신적인 게임플레이를 경험해 보세요!","Tintin Reporter - Cigars of the Pharaoh,Tintin 기자 : 파라오의 시가",Microids,"https://store.nintendo.co.kr/media/catalog/product/cache/a7267a3b8c99c74f0bde248fd00edb94/a/7/a7521647777828db9115d167c80b1ec0d78686f9eec05a76142341003978e258.jpg,https://store.nintendo.co.kr/media/catalog/product/cache/a7267a3b8c99c74f0bde248fd00edb94/2/e/2e2cfa871396627fcf96e6059b196ebe5a1ba2343ca799d6dc34a39dbc324eec.jpg,https://store.nintendo.co.kr/media/catalog/product/cache/a7267a3b8c99c74f0bde248fd00edb94/a/1/a1ee5e984ab88c9a18aa4ebee37316cfef3fb07f98a64df6c623e1548f365d6e.jpg,https://store.nintendo.co.kr/media/catalog/product/cache/a7267a3b8c99c74f0bde248fd00edb94/0/a/0a82b33dda3f91a6819b8312493ce4fb649c9c03752529db63e29742d626e892.jpg,https://store.nintendo.co.kr/media/catalog/product/cache/a7267a3b8c99c74f0bde248fd00edb94/f/a/fa8c1ff6dd64310689599ba5a58885a80607a5220a09db7188387b4824c32339.jpg,https://store.nintendo.co.kr/media/catalog/product/cache/a7267a3b8c99c74f0bde248fd00edb94/5/0/50859c2fc9341e2d2ab78960e4f63d0cad42f1a55c022799b02a3a079ab533e9.jpg",어드벤처,switch
https://store.nintendo.co.kr/70010000086196,UFO ROBOT GRENDIZER – The Feast of the Wolves,2024-10-10,https://store.nintendo.co.kr/media/catalog/product/cache/a7267a3b8c99c74f0bde248fd00edb94/4/5/456764f5221434e964bbb6de1693daea64669e29ff9562dc3be5aaba79643f81.jpg,"예약구입 상품입니다.

비디오 게임 사상 최초로, 전설적인 로봇 Grendizer에 탑승하여 악의 세력을 무찌르고 지구를 지켜내세요!
유명한 거대 로봇 그렌다이저와 함께하는 잊지 못할 모험이 찾아옵니다. 컬트적인 인기를 누린 애니메이션 시리즈에 기반을 둔 이 액션/어드벤처 게임에서, 원작자 나가이 고가 창조한 세계관 한가운데로 들어가 최강의 로봇을 조종하여 악의 세력과 맞서 싸우세요.

프리드 행성이 Empire of Vega에게 멸망하자, Daisuke 왕자는 지구로 피신했습니다. 그는 Genzo Umon에게 거둬져 Shirakaba Farm에서 살게 되었습니다. Vega의 지구 침공이 임박하자, Daisuke는 Genzo Umon의 연구소 깊은 곳에 숨겨져 있던 거대 로봇, Grendizer의 도움으로 지구를 지켜내고자 합니다. 이제 Planet Fleed의 왕자는 Koji Kabuto의 도움을 받아, 베가성 연합군의 끊임없는 공세를 막아내며, 이들이 보내는 끔찍한 전투 로봇 Monstronefs에 맞서 싸워야 합니다.

Daisuke와 그의 초대형 로봇으로 플레이하며, Spazer(그렌다이저 내부에 탑재된 비행 모듈) 조종, Koji Kabuto's TFO로 펼치는 수직 슈팅, 그리고 Grendizer를 조종하는 3인칭 액션/전투 등 다양한 게임플레이로 웅장한 전투를 펼치세요. 그렌다이저를 상징하는 막강한 공격을 사용하여 공포의 Monstronefs 군단을 무찌르고 지구를 구하세요.

오리지널 시리즈를 충실히 재현한 스토리 속에서, Daisuke가 되어 시리즈를 상징하는 여러 장소에서 다양한 주요 캐릭터들을 만나고 대화하세요.
또한 임무를 완료하고 경험치를 획득하여 새로운 능력을 해제하고 전투력을 강화하세요.

Grendizer는 반전 넘치는 뛰어난 스토리로, 프랑스에서 40년 넘게 여러 세대를 거쳐 컬트적인 인기를 누려온 애니메이션 시리즈입니다. 전 세계 수백만 명의 사람들이 지금도 이 로봇의 변신 모습과 강력한 펀치를 기억합니다.

게임 특징
• 사상 최초로 Grendizer와 Umon Daisuke를 플레이해 볼 수 있는, 강철 거인들로 가득한 액션/어드벤처 게임입니다.
• 이 거대 로봇의 필수 요소인 다양한 공격기를 사용하고 강화하세요
• TV 시리즈의 모든 캐릭터와 상징적인 장소, 적들을 찾아내세요.
• 액션/난투, TPS, 슈팅, 탐험 등 다양한 게임 페이즈를 통해 새로운 게이밍 경험을 선사합니다.
• 시리즈의 상징적인 음악들이 리마스터링되어 게임 전반에 울려 퍼집니다",UFO ROBOT GRENDIZER – The Feast of the Wolves,Microids,"https://store.nintendo.co.kr/media/catalog/product/cache/a7267a3b8c99c74f0bde248fd00edb94/4/5/456764f5221434e964bbb6de1693daea64669e29ff9562dc3be5aaba79643f81.jpg,https://store.nintendo.co.kr/media/catalog/product/cache/a7267a3b8c99c74f0bde248fd00edb94/d/2/d230cb0b2f3483a61ecd0b8614f7c4205b2920941d3e77c471054efb74689ef7.jpg,https://store.nintendo.co.kr/media/catalog/product/cache/a7267a3b8c99c74f0bde248fd00edb94/4/1/416499a156d62a28f0a0751b77f2594acf3c2a9d0a8faeafaba44f29cb5301b1.jpg,https://store.nintendo.co.kr/media/catalog/product/cache/a7267a3b8c99c74f0bde248fd00edb94/d/e/de99482538a55a767818d5c229294e77f99cb033113875bbc4f66a4f4141da09.jpg,https://store.nintendo.co.kr/media/catalog/product/cache/a7267a3b8c99c74f0bde248fd00edb94/0/8/08761e6c9d472dae45c2c8c7ca7ca3a0a2ff3a6b8045e0bb8e14f8c49318bf84.jpg,https://store.nintendo.co.kr/media/catalog/product/cache/a7267a3b8c99c74f0bde248fd00edb94/9/9/9944d72d0b23ad5a30c496af14c10c6e3d4011f3728a2f75d7811d8501847b25.jpg,https://store.nintendo.co.kr/media/catalog/product/cache/a7267a3b8c99c74f0bde248fd00edb94/7/b/7bff5f587b8e19ac0503b1f8feabc188298a0ca0f98ec48a30d23209770cc5fc.jpg","액션,어드벤처,아케이드",switch
https://store.nintendo.co.kr/70010000081877,Kill The Crows,2024-10-07,https://store.nintendo.co.kr/media/catalog/product/cache/a7267a3b8c99c74f0bde248fd00edb94/a/9/a956af060bbc4e6d7afb8a6af071df80a4ae8fbd71edf4855c72240cfefb61ec.jpg,"예약구입 상품입니다.

""누구도 이곳에서 살아나갈 수 없다""
Kill The Crows는 뒤틀린 서부시대를 배경으로 한 빠른 페이스의 탑다운 아레나 슈터입니다. 복수심에 불타는 총잡이는 죽음을 각오하고 폐허가 된 마을을 찾아옵니다. 고전적인 리볼버와 패닝 기술을 활용해 원샷-원킬의 총격전을 대비하세요. 실수는 곧 죽음이고, 죽음은 필연적입니다.

빠르고 강렬한 서부시대 총격전
• 플레이어는 리볼버와 특별한 능력인 “쇼다운”을 사용해 총격전을 펼칩니다.
• 플레이어, 적, 심지어 보스 까지도 모두 한 발의 총알에 쓰러집니다. 주어진 무기와 환경을 활용하여 최대한 많은 적들을 쓰러트리세요.
• 사격으로 쇼다운을 준비하고, 쇼다운으로 다시 총알을 채우세요. 전투의 흐름을 유지하는 것이 핵심입니다.

매력적으로 디자인 된 광신도 집단
• 보스를 포함한 총 12종의 광신도 적들이 개성 넘치게 디자인되어 있습니다.
• 샤프슈터의 정밀 사격을 피해 숨고, 구르기를 통해 디펜더의 뒤를 잡으세요. 모든 적은 각기 다른 공격 패턴과 대응 전략을 가지고 있습니다.
• 모든 캐릭터는 고유한 아름다운 픽셀아트 애니메이션을 가지고 있습니다. 봄버의 화려한 동작에 현혹되어 폭발에 휘말리지 않도록 주의하세요!

경험을 확장하는 태스크와 기어 요소
• 태스크를 완료하여 새로운 기어를 해금하세요.
• 다양한 종류의 리볼버, 쇼다운, 패시브를 조합하여 나만의 빌드를 완성하세요.
• 시간이 지날수록 더 어려운 적들과 보스가 나타납니다. 새로운 무기를 장착하여 긴 싸움에 대비하세요.

총잡이 이사벨라와 폐허가 된 마을의 이야기
• 아름다웠던 이 마을은 왜 폐허가 되었을까요? 까마귀 모습의 이들은 도대체 누구일까요? 총잡이는 어째서 자신의 목숨을 걸고 이 학살극을 시작한 것일까요?
• 게임을 진행하면서 총잡이 이사벨라의 이야기를 점차 파악해보세요.",Kill The Crows,5minlab,"https://store.nintendo.co.kr/media/catalog/product/cache/a7267a3b8c99c74f0bde248fd00edb94/a/9/a956af060bbc4e6d7afb8a6af071df80a4ae8fbd71edf4855c72240cfefb61ec.jpg,https://store.nintendo.co.kr/media/catalog/product/cache/a7267a3b8c99c74f0bde248fd00edb94/0/7/073d024e0ce0a114aac179172a4236efccde24ad2ce2ee2308820a1df95c47ae.jpeg,https://store.nintendo.co.kr/media/catalog/product/cache/a7267a3b8c99c74f0bde248fd00edb94/c/9/c968eddc2b5ead7a13f7a6ace227326dea34f2d7dfb56ba7fe0c82901fba0def.jpeg,https://store.nintendo.co.kr/media/catalog/product/cache/a7267a3b8c99c74f0bde248fd00edb94/4/c/4c66dbf0483add35ec4243e5d3c1d90feb618c95339d2ba826d94f4944bacc9c.jpeg,https://store.nintendo.co.kr/media/catalog/product/cache/a7267a3b8c99c74f0bde248fd00edb94/b/6/b64545aeafbfac0a010408c7b603127a3303534ee2a2acc7433dbdcee6819552.jpeg,https://store.nintendo.co.kr/media/catalog/product/cache/a7267a3b8c99c74f0bde248fd00edb94/d/9/d9ef55ec4253af5589bad9d41c7b385e5bff63fc9fad41a5427ce7b8b154b21d.jpeg,https://store.nintendo.co.kr/media/catalog/product/cache/a7267a3b8c99c74f0bde248fd00edb94/3/6/3681033156e7ac5c1ea6fb349b59be3ca948603a1ea0836c87be597ded7d45da.jpeg","액션,아케이드,슈팅",switch
