url,title,date,imageurl,description,autokwd,company,screenshot,tag,platform
https://store.nintendo.co.kr/70010000076970,Monospaced Lovers,2024-10-31,https://store.nintendo.co.kr/media/catalog/product/cache/a7267a3b8c99c74f0bde248fd00edb94/a/9/a933985ce23f656cde796328d3f48807038944eea3a05f462b1abc978253a27e.jpg,"예약구입 상품입니다.

친밀함과 거리에 대한 탐험 중심의 플랫포머입니다.
메타픽션적이고 판타지로 가득 찬 땅을 여행하며, 세상이 무너지기 전에 깨지기 쉬운 세상의 진실을 찾으세요.

Monospaced Lovers는 전통적인 메트로이드바니아 공식에 도전하는 반 하드코어 플랫폼 어드벤처 게임입니다.

이 게임은 독창적이기를 추구합니다. 기존 장르 두 개를 합친 것 이상의 새로운 경험입니다.

---

경이로움과 모험의 감각
게임 내 힌트를 사용하고 싶게 만드는 색다른 메타픽션 퍼즐을 풀어보세요. 어른처럼 대하는 게임으로 어린아이 같은 탐험 감각을 되살려보세요.

줄거리의 전환과 장르를 초월한 전개
10만 단어 이상의 진심 어린 스토리를 경험하세요. 코미디! 드라마! 사회적 불안! 철학? 우리는 ""침묵의 주인공""이라는 상투적인 표현을 버리고 자신만의 개성과 감정을 가진 여주인공을 만들었습니다. 그녀는 항상 여러분보다 한 발 앞서 있습니다.

탐험할 수 있는 손으로 그린 세계
지역 타누키족과 수다를 떨고, 슬라임스피크를 번역하는 법을 배우고, 60개 이상의 수집품을 모두 찾을 때까지 고풍스러운 고향 마을의 구석구석을 탐험하세요. 이 게임은 RPG 스타일의 스토리 퀘스트와 혼합된 비선형 수집형 탐험을 특징으로 합니다.

총알 지옥과 플랫폼이 만나다
총알을 피하세요! 4개 이상의 총알 지옥 보스 전투와 더 많은 챌린지 룸에서 완전히 새로운 방식으로 플랫폼을 만드는 법을 배워야 합니다.

---

스토리
클라라는 자신의 것이 아닌 전화기에서 깨어납니다.

그녀는 그 안에서 바이너리의 신이라는 해커가 남긴 당혹스러운 메시지를 발견하는데, 이 메시지에는 그녀가 이 세상에서 남은 시간이 짧다는 내용이 담겨 있습니다. 그녀의 유일한 단서는 장치에 잠긴 일련의 암호화된 메시지와 자신의 것이 아닌 전화기에서 깨어난 신비한 새로운 친구입니다.

이 수수께끼 같은 해커는 무엇을 원하는 걸까요? 왜 세상의 종말에 대해 이야기하는 걸까요? 그리고 이 모든 것이 헤이븐 하이츠에서 클라라가 사는 고요하고 평화로운 삶과 무슨 관련이 있을까요?

우리가 확실히 아는 것은 그녀가 이 탐구에 나서지 않는다면... 그녀의 친구들이 그녀를 끌어들일 것이라는 것입니다.

바이너리의 신의 미스터리를 풀고 이 이상하지만 편안한 세계의 진실을 밝힐 준비가 되셨나요?

글쎄요... 별로 중요하지 않죠?

진실에서 도망칠 수는 없습니다. 준비가 되든 안 되든 말입니다.",Monospaced Lovers,Astrolabe Games,"https://store.nintendo.co.kr/media/catalog/product/cache/a7267a3b8c99c74f0bde248fd00edb94/a/9/a933985ce23f656cde796328d3f48807038944eea3a05f462b1abc978253a27e.jpg,https://store.nintendo.co.kr/media/catalog/product/cache/a7267a3b8c99c74f0bde248fd00edb94/1/7/17d71f72b5affd7271eeca4d23e3acd75fa854b21dc6c822db6d33ea68a53c16.jpg,https://store.nintendo.co.kr/media/catalog/product/cache/a7267a3b8c99c74f0bde248fd00edb94/6/9/69a01cfdad139956842decb2fcee6f8fc5c834258c5977299aa0000538d103d9.jpg,https://store.nintendo.co.kr/media/catalog/product/cache/a7267a3b8c99c74f0bde248fd00edb94/5/e/5e8c295481181a96c31c3a420cbc8b0b5b497b5334829832535fe69f1b9d0110.jpg,https://store.nintendo.co.kr/media/catalog/product/cache/a7267a3b8c99c74f0bde248fd00edb94/0/c/0cb0522940227be9628f1f1c2912694a55d0e90422272fc2e7498edbeaf7c493.jpg,https://store.nintendo.co.kr/media/catalog/product/cache/a7267a3b8c99c74f0bde248fd00edb94/f/a/fa4171488fa52ddf6d4edb9b7714918e4df115d1848fd1b58b18e7c355df3960.jpg,https://store.nintendo.co.kr/media/catalog/product/cache/a7267a3b8c99c74f0bde248fd00edb94/e/7/e768e165157c4d0bc6669c267644c9266842c2dbb96b286d5457a6c6612ce8d8.jpg","액션,어드벤처,퍼즐",switch
https://store.nintendo.co.kr/70010000086880,Santa's Spot It,2024-10-31,https://store.nintendo.co.kr/media/catalog/product/cache/a7267a3b8c99c74f0bde248fd00edb94/5/e/5eb6a8214806202738d9134c8c9bdf741bc8722ed7475b9e79e67202725e2e8b.jpeg,"예약구입 상품입니다.

산타의 스팟 잇과 함께 크리스마스의 마법 속으로 뛰어들 준비를 하세요! 모든 연령대에 완벽한 이 궁극의 휴일 테마 퍼즐 게임을 즐겨보세요!
크리스마스 마을을 탐험하세요. 당신의 임무는? 두 개의 유사한 장면 사이의 차이점을 찾아내어 다음 단계로 나아가는 것입니다.

산타의 스팟 잇은 진행할수록 난이도가 증가하는 여러 단계와 함께 도전과 매력을 절묘하게 결합한 게임입니다. 모든 장면은 여러분을 집중하게 만들 축제 세부 사항들로 가득합니다. 차이점을 찾는 게임의 베테랑이든 초보자이든, 이 게임의 직관적인 디자인은 온 가족이 함께 즐길 수 있는 재미를 보장합니다.",Santa's Spot It,SURPRISED HOTDOG,"https://store.nintendo.co.kr/media/catalog/product/cache/a7267a3b8c99c74f0bde248fd00edb94/5/e/5eb6a8214806202738d9134c8c9bdf741bc8722ed7475b9e79e67202725e2e8b.jpeg,https://store.nintendo.co.kr/media/catalog/product/cache/a7267a3b8c99c74f0bde248fd00edb94/f/3/f37c0dd3b6a6ae914445d3ce9c36255f5d597ace563e94d017c19845cd6e0ca0.jpeg,https://store.nintendo.co.kr/media/catalog/product/cache/a7267a3b8c99c74f0bde248fd00edb94/7/8/78ea39a6cbc9b83c42576e65a0000f8451ada3619cb19407930cdced5e71af23.jpeg,https://store.nintendo.co.kr/media/catalog/product/cache/a7267a3b8c99c74f0bde248fd00edb94/b/b/bb775073b9ac21a1fcc10728d13f9dc3d45687399616101ccbcee8d9e2b0c001.jpeg,https://store.nintendo.co.kr/media/catalog/product/cache/a7267a3b8c99c74f0bde248fd00edb94/d/d/dd9626fee94bdfb57f90179a9ca282f56395599f6b73a8696745c1536b1d17fb.jpeg,https://store.nintendo.co.kr/media/catalog/product/cache/a7267a3b8c99c74f0bde248fd00edb94/5/e/5eb6a8214806202738d9134c8c9bdf741bc8722ed7475b9e79e67202725e2e8b.jpeg","어드벤처,퍼즐,시뮬레이션",switch
https://store.nintendo.co.kr/70010000077970,Police Simulator: Patrol Officers: Nintendo Switch™ Edition,2024-10-29,https://store.nintendo.co.kr/media/catalog/product/cache/a7267a3b8c99c74f0bde248fd00edb94/d/3/d3b8ae0ed4675c3370bf6d774f668707f9fe50a28bcd6ee2e27dc934339d3882.jpg,"예약구입 상품입니다.

Nintendo Switch™를 들고 가상의 미국 도시를 담당하는 경찰이 되어 경찰의 일상을 경험해 보세요. 주차 위반 단속부터 시작해 점차 더 큰 책임을 맡게 됩니다. Brighton 커뮤니티의 일원이 되어 지역을 제대로 파악하고, 근무 시간 중 범죄에 맞서 싸우며 일상적인 경찰의 업무를 처리하세요. 항상 강인하면서도 공정한 경찰이 되어야 합니다. 법을 준수하며 많은 경험치를 쌓아 더 많은 지역과 구역, 임무를 잠금 해제하세요! 즉시 대응할 수 있도록 준비해두세요! Brighton의 오픈 월드 속에서 순찰할 지역을 선택해 안전을 유지하세요. 더욱 진짜 같은 경험을 원하는 숙련된 플레이어를 위한 시뮬레이션 모드와 Brighton의 거리를 좀 더 느긋하게 순찰하고 싶어 하는 플레이어를 위한 캐주얼 모드를 제공합니다.

순찰을 나가고, 범칙금 업무 등의 근무를 시작하세요. 눈앞에서 사고가 발생할 수 있으니 미리 대비하세요! 생동감 넘치는 도시에서 다양한 임무가 여러분을 기다립니다. 지역 공원에 자리 잡은 마약상을 저지하거나, 불법적으로 벽에 그림을 그리는 그라피티 범법자를 추적하거나, 경찰 사이렌을 울리며 과속 차량을 단속하거나, 교통사고 구역에 도로 차단벽과 안전콘을 설치하세요. 버스 정류장의 자동차 불법 주차 같은 경미한 사건부터 용의자를 체포해 구금실로 이송하는 업무까지 모든 상황에 대비하세요. 직무에 충실하고 사회에 봉사하세요!

순찰: 경찰관의 일상을 경험하세요
대규모 오픈 월드: 각각 개성 있는 여러 지역으로 이루어진 3개의 구역
책임: XY개 이상의 법규 위반 및 범법
파트너: 친구를 초대해 함께 순찰하세요
초보자 친화적: 법규 위반을 식별할 직관 시스템
나만의 방식: 캐주얼 및 시뮬레이션 모드 선택 가능",Police Simulator: Patrol Officers: Nintendo Switch™ Edition,astragon,"https://store.nintendo.co.kr/media/catalog/product/cache/a7267a3b8c99c74f0bde248fd00edb94/d/3/d3b8ae0ed4675c3370bf6d774f668707f9fe50a28bcd6ee2e27dc934339d3882.jpg,https://store.nintendo.co.kr/media/catalog/product/cache/a7267a3b8c99c74f0bde248fd00edb94/2/b/2b4862de0bc878175eae2bcc19328c705dbe99f0fa297ca7d4b51f254179b1b1.jpg,https://store.nintendo.co.kr/media/catalog/product/cache/a7267a3b8c99c74f0bde248fd00edb94/c/5/c51538c8b2215a2dbee9bf8787f7791301bca13dd09ed223a276d07a1b540007.jpg,https://store.nintendo.co.kr/media/catalog/product/cache/a7267a3b8c99c74f0bde248fd00edb94/9/a/9ae35c7eb4d02b89eeadff2b973396229b17829c00f658cac188440f7818e38d.jpg,https://store.nintendo.co.kr/media/catalog/product/cache/a7267a3b8c99c74f0bde248fd00edb94/3/a/3a28d648fdce81395d87b576a33280876f0f4790cc7b9314f5bd9305115ab6b9.jpg,https://store.nintendo.co.kr/media/catalog/product/cache/a7267a3b8c99c74f0bde248fd00edb94/c/a/cafa8280d7c44189da2ebaf89ceade558beda3cec9aee4d3e8d87d232ac242e0.jpg,https://store.nintendo.co.kr/media/catalog/product/cache/a7267a3b8c99c74f0bde248fd00edb94/7/9/7948d74294f678912a7be2581e9062cda0baf8a07ccd77adcbdf0d33857a264c.jpg",시뮬레이션,switch
https://store.nintendo.co.kr/70010000081907,SONIC X SHADOW GENERATIONS,2024-10-25,https://store.nintendo.co.kr/media/catalog/product/cache/a7267a3b8c99c74f0bde248fd00edb94/9/3/93e7139cc7dfe1b57442f1762f47a40c17751339b050aafcc1cc688d97080b4c.jpg,"예약구입 상품입니다.

두 타이틀이 세트로 구성된 『소닉×섀도우 제너레이션즈』로 하이 스피드 액션 어드벤처를 마음껏 즐기자!
수수께끼의 괴물 '타임 이터'에 의해 생겨난 시공의 왜곡으로 인해 소닉과 섀도우의 운명은 움직이기 시작한다!

다크 히어로 '섀도우'가 종횡무진 질주하는 완전 신작 『섀도우 제너레이션즈』
신규 요소가 추가되어 다양한 스테이지의 스피드런을 즐길 수 있는 『소닉 제너레이션즈』

두 타이틀이 세트로 구성된 『소닉×섀도우 제너레이션즈』로 하이 스피드 액션 어드벤처를 마음껏 즐기자!

『섀도우 제너레이션즈』:
▼다크 히어로 '섀도우' 등장!
완전 신작 『섀도우 제너레이션즈』에서는 소닉의 라이벌 '섀도우'를 주인공으로 하는 새로운 스토리를 체험할 수 있습니다.

궁극의 생명체로 태어난 검은 고슴도치 '섀도우'와 그를 노리는 수상한 그림자, '블랙 둠'.
한때 세계 정복을 계획하다 섀도우에게 패해 쓰러졌던 그 사악한 초생명체가 다시 어둠을 드리우고 있었다.
자신의 과거, 새로운 힘, 지켜야 하는 이들… 빛과 어둠 사이에서 갈등하는 섀도우의 손에 세계의 운명이 달려 있다!

▼'화이트 스페이스'를 종횡무진 질주하며 탐색하자!
『섀도우 제너레이션즈』에서는 자유롭게 이동할 수 있는 3D 맵 '화이트 스페이스'를 중심으로 스토리가 진행됩니다.
'둠 파워'를 얻으면 갈 수 있는 곳이 더욱 확장되며, 다른 캐릭터와의 대화나 숨겨진 아이템 탐색, 챌린지 도전 등의 다양한 재미 요소 또한 가득합니다.
종횡무진 질주하면서 '화이트 스페이스'를 빠짐없이 즐겨 보세요!

『소닉 제너레이션즈』:
▼'클래식 소닉'과 '모던 소닉'의 만남!
『소닉 제너레이션즈』에서는 시공의 왜곡으로 인해 '클래식 소닉'과 '모던 소닉'이 같은 세계에 등장.
수수께끼의 괴물 '타임 이터'로 인해 혼란해진 세계의 질서를 되찾고 시공의 왜곡에 갇혀버린 친구들을 돕기 위해 두 파란 고슴도치가 나선다!
활기 넘치는 거리와 대자연에 둘러싸인 산, 유독성 화학 공장부터 하늘에 떠 있는 신전까지, 다양한 스테이지를 음속으로 질주하세요!

▼추가 요소로 더욱 흥미진진하게!
각지에 흩어져 있는 귀여운 생명체 챠오를 구출하는 '챠오 레스큐'와 플레이의 폭을 넓히는 '드롭 대시' 액션을 신규 추가!
또한, 인기 다운로드 콘텐츠 '카지노 나이트 핀볼'도 수록되어 있는 등, 더욱 충실해진 『소닉 제너레이션즈』를 즐길 수 있습니다.","SONIC X SHADOW GENERATIONS,소닉×섀도우 제너레이션즈",SEGA,"https://store.nintendo.co.kr/media/catalog/product/cache/a7267a3b8c99c74f0bde248fd00edb94/9/3/93e7139cc7dfe1b57442f1762f47a40c17751339b050aafcc1cc688d97080b4c.jpg,https://store.nintendo.co.kr/media/catalog/product/cache/a7267a3b8c99c74f0bde248fd00edb94/0/7/077ef07564abf3e771c7ed4338218fabdc99e3048f7a3304b33109870a6bb97b.jpg,https://store.nintendo.co.kr/media/catalog/product/cache/a7267a3b8c99c74f0bde248fd00edb94/b/4/b4800c5a6a5ddea4a92671ec64b19f105623320accda74f17857c35d133e39f9.jpg,https://store.nintendo.co.kr/media/catalog/product/cache/a7267a3b8c99c74f0bde248fd00edb94/e/e/eedf5a2f7aabf4b30256ed05930168b48c52645fb1b919dabc5bbd6b3a545dbf.jpg,https://store.nintendo.co.kr/media/catalog/product/cache/a7267a3b8c99c74f0bde248fd00edb94/2/c/2c96ea0ef8e676dfe4e68965a24d5a89837f0ee3f25093cf6adb6f37e3fe0ef4.jpg,https://store.nintendo.co.kr/media/catalog/product/cache/a7267a3b8c99c74f0bde248fd00edb94/4/9/49790de1ccce070ac2ea82ff8765e751d80e8df40d9b1dd3e291d16561d11cda.jpg,https://store.nintendo.co.kr/media/catalog/product/cache/a7267a3b8c99c74f0bde248fd00edb94/b/b/bbb29b9fb263a9f5603f3c18617097b4a99a3c870aeed5b0b64d52c493eb9290.jpg","액션,어드벤처",switch
https://store.nintendo.co.kr/70010000058323,Neon Blood,2024-10-24,https://store.nintendo.co.kr/media/catalog/product/cache/a7267a3b8c99c74f0bde248fd00edb94/e/3/e352d8a71557e8b5b418e1339ecb79b4eea964a33f9782631f08e3539ed9cba5.jpg,"예약구입 상품입니다.

호화로운 브라이트 시티와 위험한 블라인드 시티로 나뉘어 불평등이 지배하는 두 개의 비리디스는 이상주의 탐정 악셀 맥코인에 의해 혁명이 시작됩니다.
2053년, 우리가 알고 있는 세상은 시간을 잃은 전쟁으로 종말을 맞았습니다. 이제 위험한 블라인드 시티와 호화로운 브라이트 시티를 아우르는 대도시 비리디스에는 불평등만 남았습니다.

한때 경찰 형사였던 악셀 맥코인은 비리디스의 불안정한 평화를 괴롭히는 부패와 권력의 음모를 밝혀내는 데 핵심적인 역할을 하게 됩니다.

기존 질서를 전복하고 부패한 사회의 토대를 무너뜨리는 악셀과 함께 도시와 주민들의 이야기를 경험해 보세요.

주요 특징

- 사이버 펑크 테마의 정교하고 깊이 있는 스토리와 강력한 전략 요소를 갖춘 오래된 RPG와 같은 턴제 전투 스타일이 결합되었습니다.
- 사이버 펑크와 공상 과학이 결합 된 완벽한 2.5D 미학을 가진 두 도시의 두 가지 현실
- 완벽한 대화 기반 탐정 시스템으로 풀어야 할 비밀로 가득한 거대한 대도시
- 수많은 네온",Neon Blood,MERIDIEM GAMES,"https://store.nintendo.co.kr/media/catalog/product/cache/a7267a3b8c99c74f0bde248fd00edb94/e/3/e352d8a71557e8b5b418e1339ecb79b4eea964a33f9782631f08e3539ed9cba5.jpg,https://store.nintendo.co.kr/media/catalog/product/cache/a7267a3b8c99c74f0bde248fd00edb94/4/6/467e04d34b13d343cb7acc2c478095774cf49361a91dbce936bc8e5cef1e2cef.jpg,https://store.nintendo.co.kr/media/catalog/product/cache/a7267a3b8c99c74f0bde248fd00edb94/f/1/f1a3047e3563b7cee8fccc9a0082c50e3c9b312f3a78cc61dd9e24a50b018ede.jpg,https://store.nintendo.co.kr/media/catalog/product/cache/a7267a3b8c99c74f0bde248fd00edb94/2/4/249820cb96776c9b99c788f576b2e13c107b0f5f8efff24b624860c66f841d22.jpg,https://store.nintendo.co.kr/media/catalog/product/cache/a7267a3b8c99c74f0bde248fd00edb94/f/7/f71722c7dfede3cdec7f543a34e340cf8a7a52d36af82659cf91298394b70b35.jpg,https://store.nintendo.co.kr/media/catalog/product/cache/a7267a3b8c99c74f0bde248fd00edb94/7/8/78b7805d889eada89d5db274eb470409fa4ff44b54cf034c0b7c6e2ca798af05.jpg,https://store.nintendo.co.kr/media/catalog/product/cache/a7267a3b8c99c74f0bde248fd00edb94/5/2/526437a245b0d7466eb39036fb7f2cfa27006dd973ea99c92bba69724f5e5818.jpg","RPG,어드벤처",switch
https://store.nintendo.co.kr/70010000075965,Orange Season,2024-10-24,https://store.nintendo.co.kr/media/catalog/product/cache/a7267a3b8c99c74f0bde248fd00edb94/7/5/75a35de2f07b3c12753ea08a0aafa5b4363cff4d6b6e0d43c34cc2f4d101ee69.jpg,"예약구입 상품입니다.

Orange Season은 농장 RPG 장르의 명작에서 영감을 얻은 게임입니다.
매력적인 오렌지 타운에서 귀농의 꿈을 이루세요.

작물을 재배하고, 동물을 기르고, 낚시하고, 채굴하며 수익성 높은 성공한 농장을 만들어 가세요. 퀘스트를 수행해 주민들과 친해지고, 평생 지속될 의미 있는 관계를 쌓으세요. 가끔은 일손을 놓고 마을 축제와 미니게임에 참여해 휴식을 취하세요. Orange Season에서의 새로운 삶이 주는 시련에 대처해 가며 탐험하고 농장을 일구세요!

오렌지 타운은 저마다 다른 비밀, 문제, 사연을 가진 다양한 사람들이 살아가는 곳입니다. 주민들을 알아가며 친구를 사귀고, 끈끈한 인맥을 쌓고, 자신의 길을 찾아 보세요. 과연 이 생기 넘치는 공동체에서 성공하실 수 있을까요?

특징:

메인 스토리를 따라가며 농장에서의 새로운 삶이 주는 시련을 극복하세요.

정성을 담아 직접 만든 독특하고 다양한 지역들을 탐험하세요.

다양한 마을 축제 및 미니게임에 참여하세요.

농장에서 동물을 기르고, 낚시하고, 채굴하고, 작물을 심으세요.

마을 주민들과 상호작용하고 퀘스트를 완료하며 인맥을 쌓으세요.

농장을 맞춤 설정 및 확장하며 자신이 그리는 모습으로 만들어 가세요.",Orange Season,Soedesco,"https://store.nintendo.co.kr/media/catalog/product/cache/a7267a3b8c99c74f0bde248fd00edb94/7/5/75a35de2f07b3c12753ea08a0aafa5b4363cff4d6b6e0d43c34cc2f4d101ee69.jpg,https://store.nintendo.co.kr/media/catalog/product/cache/a7267a3b8c99c74f0bde248fd00edb94/1/7/178cf34dc6d568b698060867b934e5279ec4324f12d220116f1d8989919e01cd.jpg,https://store.nintendo.co.kr/media/catalog/product/cache/a7267a3b8c99c74f0bde248fd00edb94/b/3/b348fdad05635aa6cb54e208c8b399618589ec6397fdb6a7dd61f3a13e72594c.jpg,https://store.nintendo.co.kr/media/catalog/product/cache/a7267a3b8c99c74f0bde248fd00edb94/1/8/18fa5aa2394cbfbd370a8b6bb14c1a5a31d1826b7f40b670d67d402e4975a6f2.jpg,https://store.nintendo.co.kr/media/catalog/product/cache/a7267a3b8c99c74f0bde248fd00edb94/d/e/de444cdefc5774906954c83d5d3728ff28847988c2325f68b5353f952d5955a8.jpg,https://store.nintendo.co.kr/media/catalog/product/cache/a7267a3b8c99c74f0bde248fd00edb94/8/1/81e22ac3446ae98ff8946d9694ea1b3818b065ee965e75626f7761e3a2a03ef5.jpg","RPG,시뮬레이션",switch
https://store.nintendo.co.kr/70010000085809,토블라 - 신성한 길,2024-10-24,https://store.nintendo.co.kr/media/catalog/product/cache/a7267a3b8c99c74f0bde248fd00edb94/c/b/cb739dd19be1f801f7a833cd8aa9c460a97286f52018d2ab70407ca93772deef.jpg,"예약구입 상품입니다.

창의적인 퍼즐을 마스터하고 집으로 가는 길을 찾아라!
토블라 - 신성한 길 는 창의적인 퍼즐 게임 플레이, 흥미진진한 이야기, 그리고 매혹적인 비주얼 디자인을 제공합니다. 교활한 여신 토블라에게 선택된 인간 모르트로서, 물리 기반 퍼즐을 풀고, 거만한 발언에 대처하며, 토블라의 계획을 저지하려고 합니다.

큐브를 교환하고, 구체를 굴리고, 폭탄을 사용하여 어려운 장애물을 극복하고 토블라의 시험을 통과하며 흥미진진한 물리 기반 퍼즐을 해결하세요.

건방진 여신 토블라에 맞서 싸우고 그녀의 거만한 발언에 대처하며 도전적인 퍼즐 창작물을 마스터하세요.

도전적인 퍼즐과 흥미진진한 시나리오로 가득 찬 오후나 저녁에 완벽한 컴팩트한 모험을 경험하세요.

교묘한 퍼즐과 조작적인 내레이터가 특징인 유머러스한 이야기를 즐기세요.

본질에 집중하고 잘 설계된 퍼즐 요소로 감동을 주는 인디 게임에서 집중된 퍼즐 메커니즘을 발견하세요.",토블라 - 신성한 길,Rokaplay,"https://store.nintendo.co.kr/media/catalog/product/cache/a7267a3b8c99c74f0bde248fd00edb94/c/b/cb739dd19be1f801f7a833cd8aa9c460a97286f52018d2ab70407ca93772deef.jpg,https://store.nintendo.co.kr/media/catalog/product/cache/a7267a3b8c99c74f0bde248fd00edb94/3/9/39005914502578ff8f8308d1bccc211e97fecd70c66e9bd8329bb9bb076590cb.jpg,https://store.nintendo.co.kr/media/catalog/product/cache/a7267a3b8c99c74f0bde248fd00edb94/d/7/d79f20292f9db8dab659593b75a5deba0f380c6982d1964d771b7a8555dc25cc.jpg,https://store.nintendo.co.kr/media/catalog/product/cache/a7267a3b8c99c74f0bde248fd00edb94/9/f/9feb679a98c8e51f0ce4b447138face1aaaa3e0743981aeb4e9c0ed7c4522056.jpg,https://store.nintendo.co.kr/media/catalog/product/cache/a7267a3b8c99c74f0bde248fd00edb94/a/7/a7ccd273a65ea4f4250b6e3336722e37c43dee729b5682c8b20b776f092127be.jpg,https://store.nintendo.co.kr/media/catalog/product/cache/a7267a3b8c99c74f0bde248fd00edb94/6/c/6cb3343eb158d3aad27fb779264ae6f21758a6b4d2188e3b8df4fd16960e4d4d.jpg,https://store.nintendo.co.kr/media/catalog/product/cache/a7267a3b8c99c74f0bde248fd00edb94/3/1/31e2b10923b96d2e344f19649982e218dc82b6e56c7de4318beec5b3e7a11a18.jpg","퍼즐,슈팅,트레이닝,학습",switch
