url,title,date,imageurl,description,autokwd,company,screenshot,tag,platform
https://store.nintendo.co.kr/70010000048817,Suikoden I&II HD Remaster Gate Rune and Dunan Unification Wars,2025-03-06,https://store.nintendo.co.kr/media/catalog/product/cache/a7267a3b8c99c74f0bde248fd00edb94/7/2/72438d0f1082bd2d1644a4b1fbdb6ac7547f46edfb65828d299af5658ba959aa.jpg,"예약구입 상품입니다.

KONAMI가 선사하는 불후의 명작 RPG 『Suikoden I』＆『Suikoden II』가 HD리마스터로 등장!
108명의 동료와 함께, 지금 소년의 운명이 움직이기 시작한다.
KONAMI가 선사하는 불후의 명작 RPG 『Suikoden I』＆『Suikoden II』가 HD리마스터로 등장!

『Suikoden I』 스토리
이야기는 영웅의 격변에서 시작된다. 과거의 영웅은 폭군으로 변했고, 제국은 몰락의 때를 맞이하고 있다.
거칠어진 제국의 강압에 저항하기 위해, 마침내 해방군이 일어섰다.
천지의 숙성 108명이 하나 둘 모여, 그 모여진 힘이 역사를 뒤흔든다.

『Suikoden II』 스토리
하이랜드 왕국의 소년병 부대 「유니콘 대」로서, 5도시 1기사단으로 구성된 조우스톤 도시동맹과의 길고 척박한 국경 전쟁에 참가했던 주인공과 조우이.
몇 달 전, 이들 두 세력 사이에 휴전협정이 체결되면서 싸움에 지쳐 있던 민중은 이를 환영했다. 하지만 새로운 싸움의 불은 계속 피어나고 있었다.....

『Suikoden I&II HD REMASTER』의 특징
・모든 배경 일러스트를 HD 일러스트로 일신
・최신 이펙트로 더욱 아름다운 도트 애니메이션을 표현
・물소리, 바람소리 등 필드 사운드를 대폭 추가
・배틀 사운드도 HD 음원화를 진행해 보다 리얼해진 소리를 선사
・오토세이브
・배속 배틀
・대사 로그 표시",Suikoden I&II HD Remaster Gate Rune and Dunan Unification Wars,KONAMI,"https://store.nintendo.co.kr/media/catalog/product/cache/a7267a3b8c99c74f0bde248fd00edb94/7/2/72438d0f1082bd2d1644a4b1fbdb6ac7547f46edfb65828d299af5658ba959aa.jpg,https://store.nintendo.co.kr/media/catalog/product/cache/a7267a3b8c99c74f0bde248fd00edb94/2/e/2e09183bdd6b25cb9ce0ffa6a0324c1bb94f22684652bdb3b0e2bdbaf72521ce.jpg,https://store.nintendo.co.kr/media/catalog/product/cache/a7267a3b8c99c74f0bde248fd00edb94/9/7/975895675d3c1aa29f13ccb1197bd15eed67ec8f2054417d68c93e3251f2e084.jpg,https://store.nintendo.co.kr/media/catalog/product/cache/a7267a3b8c99c74f0bde248fd00edb94/0/1/01eeb468dcfab15dac9ab79fe13cdd32293c4d188b2721ef301dee162d09708e.jpg,https://store.nintendo.co.kr/media/catalog/product/cache/a7267a3b8c99c74f0bde248fd00edb94/8/3/83d0bcf13dd8bc4d18a95a982a2d7b7d82c72a4ac8ef1bfc7921199deaa42c57.jpg,https://store.nintendo.co.kr/media/catalog/product/cache/a7267a3b8c99c74f0bde248fd00edb94/0/c/0cf1ce3bb8e93f6f426bb5c3c5d8554b76428b8b724439533a9cf6afe2a84cd6.jpg,https://store.nintendo.co.kr/media/catalog/product/cache/a7267a3b8c99c74f0bde248fd00edb94/b/0/b06f49f367877b32d33f25f3e096b79eb11b6454d04412fdde71bd58a9517568.jpg",RPG,switch
https://store.nintendo.co.kr/70010000073080,Stories from Sol: The Gun-Dog,2025-02-20,https://store.nintendo.co.kr/media/catalog/product/cache/a7267a3b8c99c74f0bde248fd00edb94/9/4/9407c94effeaf7c6463c762c8ac91b81fcad639a505c69cece8c40616ada2725.jpeg,"예약구입 상품입니다.

전쟁은 끝났다. 전쟁은 이제 막 시작일 뿐이다.
행성 달력 214. 태양 전쟁이 끝난 지 4년이 지났습니다. 전쟁에서 동료 승무원을 잃은 상처에 시달리는 주인공은 목성 우주 끝에서 오는 신비한 신호를 조사하라는 명령을 받고 목성 순찰선 Gun-Dog에 재배치됩니다.
Gun-Dog의 승무원은 모르지만 별의 바다 깊은 곳에 새로운 위험이 도사리고 있으며 Gun-Dog뿐만 아니라 모든 승무원을 위협합니다.

Gun-Dog의 보안 책임자 역할을 맡아 알려지지 않은 공격자로부터 우주선을 구하고 승무원 사이에서 일어나는 편집증, 음모, 원한을 헤쳐 나가세요. 동료애가 깨지면서 기다리는 도전을 극복할 수 있을까요?

게임 - 레트로 애니메이션과 80년대 SF에 대한 러브레터

Stories from Sol: Gun-Dog는 고전적인 PC-9800 타이틀의 정신을 담은 비주얼 노벨 어드벤처입니다. 목성 순찰선이 별들 사이의 어둠 속으로 항해하면서 플레이어는 마치 80년대 SF에서 모험을 하는 것처럼 느낄 것이며, 자신들이 처한 미스터리를 해결할 것입니다.

스토리 - 공허에서 새로운 위협이 등장합니다.

인간은 오래 전에 중력의 손아귀에서 벗어났지만, 여전히 전쟁의 손아귀에서 벗어날 수 없습니다.
행성 달력으로 214년입니다. 태양 전쟁이 끝난 지 4년이 지났고 태양계 전체에 불안한 평화가 지속됩니다. 목성 순찰선 Gun-Dog는 목성 우주 끝에서 오는 신비한 신호를 조사하는 정찰 임무에 파견됩니다. 일상적인 임무로 시작했지만 알려지지 않은 위협이 승무원을 공포에 떨게 하면서 생존을 위한 전투로 빠르게 확대됩니다.

게임 플레이 - 조사. 상호 작용. 분석. 진행.

전통적인 포인트 앤 클릭 어드벤처 메커니즘을 활용하여 Gun-Dog에서 보내는 시간 동안 배의 다양한 위치를 탐색하고, 풍부하게 구현된 배경의 세부 사항을 조사하거나, 배 위의 다른 승무원과 대화할 수 있습니다. 중요한 단서나 이중적 의도를 밝히려면 캐릭터의 말을 주의 깊게 듣고, 스토리를 진행하는 데 사용할 수 있는 배경의 핵심 아이템과 상호 작용 요소를 주시해야 합니다.

장소 - 완전히 탐험 가능한 배에서의 모험!

""Stories from Sol"" 시리즈의 첫 번째 작품의 주요 무대인 목성 순찰선 Gun-Dog가 깊은 우주로 향하면서 게임 스토리의 배경 역할을 합니다. 완벽하게 구현되었습니다. 엔진실의 끊임없는 울림, 다리의 분주함, 우주의 고요함을 포함한 배의 풍부하고 감동적인 묘사는 세심하게 디자인되고 세부적으로 애니메이션화된 광범위한 장면과 결합되어 몰입감 있는 경험을 제공합니다. 애니메이션에서 제공하는 최고의 것에서 영감을 받은 이 배는 ""갑옷 프레임"", 기계화되고, 사람 모양의 전쟁 무기를 특징으로 합니다.

캐릭터 - Gun-Dog의 승무원과 함께 탑승하세요!

모든 스토리는 사람에 대한 것이고 ""The Gun-Dog""의 캐스트는 스토리에 생명을 불어넣습니다. 그들의 매력과 카리스마가 Astrolabe Games의 팀을 설득하여 Gun-Dog에 탑승하고 출판사로 등록하게 했습니다. 우아하면서도 냉정한 Bartermews 선장부터 쾌활한 중령 Cassandra Quinn, 단호하고 권위적인 Mackenzie Cathays 대장까지 ""The Gun-Dog""는 여러분이 만날 수 있는 광범위한 캐릭터를 특징으로 합니다. 각 승무원은 고유한 성격, 역할 및 역사를 가지고 있습니다. 그들과 그들의 기벽을 알아가고 이야기의 핵심에 있는 미스터리를 풀기 위해 그들과 협력할지, 아니면 그들과 맞서 싸울지 결정하세요.",Stories from Sol: The Gun-Dog,Astrolabe Games,"https://store.nintendo.co.kr/media/catalog/product/cache/a7267a3b8c99c74f0bde248fd00edb94/9/4/9407c94effeaf7c6463c762c8ac91b81fcad639a505c69cece8c40616ada2725.jpeg,https://store.nintendo.co.kr/media/catalog/product/cache/a7267a3b8c99c74f0bde248fd00edb94/9/0/906f8245255719d5f70e49da9d82b43e19eef9e132bb5b98799e23c58ce94670.jpeg,https://store.nintendo.co.kr/media/catalog/product/cache/a7267a3b8c99c74f0bde248fd00edb94/3/d/3d2fc364db16322c6978ab972b094db44f1a677f55f5f1ab07eddfa18209a766.jpeg,https://store.nintendo.co.kr/media/catalog/product/cache/a7267a3b8c99c74f0bde248fd00edb94/d/d/dd2ab8473cd3ed4185cae1b8e4f2574e69276a63f294f5071d6b884c708f0403.jpeg,https://store.nintendo.co.kr/media/catalog/product/cache/a7267a3b8c99c74f0bde248fd00edb94/a/0/a0c9b67148ea30eaa25984c1cd0d80021954c83711fe556acb55dbb843e5a4e3.jpeg,https://store.nintendo.co.kr/media/catalog/product/cache/a7267a3b8c99c74f0bde248fd00edb94/9/d/9de5e00b13ea4d402979e91cf4e21c3f9041f47791d4396c827726c2bbca7a60.jpeg,https://store.nintendo.co.kr/media/catalog/product/cache/a7267a3b8c99c74f0bde248fd00edb94/9/4/9407c94effeaf7c6463c762c8ac91b81fcad639a505c69cece8c40616ada2725.jpeg","RPG,어드벤처",switch
https://store.nintendo.co.kr/70010000084605,동키콩 리턴즈 HD,2025-01-16,https://store.nintendo.co.kr/media/catalog/product/cache/a7267a3b8c99c74f0bde248fd00edb94/6/b/6b151e530af2b6afa02f9d826dafe3e020ace6b0a2c9ed4262b731b1ea784b93.jpg,"현재 닌텐도 e숍에서 예약판매 중입니다.
닌텐도 온라인 스토어에서의 판매는 후일 실시 예정입니다.

다시 돌아온 리턴즈! 『동키콩 리턴즈』가 HD로 등장
닌텐도 3DS 버전에 수록된 코스를 포함해 총 80 코스에서 동키콩이 대활약!

동물을 조종하는 티키족에게 빼앗겨 버린 대량의 바나나를 되찾기 위한 모험이 시작됩니다.
앞길을 가로막는 적을 밟고, 치고, 구르고… 동키콩 특유의 액션으로 장치가 가득한 코스에 도전합니다.
그 밖에도 달리기 시작하면 멈추지 않는 광차나, 하늘을 날 수 있는 로켓나무통, 동물친구 람비 등, 다양한 탈것을 이용해 길을 개척해 나갑니다.

Joy-Con을 나눠 잡으면 힘이 센 동키콩과 몸놀림이 가벼운 디디콩을 조작, 협력하면서 모험을 즐길 수 있습니다.",동키콩 리턴즈 HD,Nintendo,"https://store.nintendo.co.kr/media/catalog/product/cache/a7267a3b8c99c74f0bde248fd00edb94/6/b/6b151e530af2b6afa02f9d826dafe3e020ace6b0a2c9ed4262b731b1ea784b93.jpg,https://store.nintendo.co.kr/media/catalog/product/cache/a7267a3b8c99c74f0bde248fd00edb94/2/7/2760a39b14f14d43162e45cfdd6daa2c8fcafe45a404b9d6394fec3c0b1bcea6.jpg,https://store.nintendo.co.kr/media/catalog/product/cache/a7267a3b8c99c74f0bde248fd00edb94/7/b/7bdf9f27403b8bd03c25c728f89f13f7314745032e6f67a19c7a979d8be1ba4e.jpg,https://store.nintendo.co.kr/media/catalog/product/cache/a7267a3b8c99c74f0bde248fd00edb94/8/6/8625196f5540bb9016fd0e9fb4e12bd3743acfeb1da9eb4c0ab6750495de047e.jpg,https://store.nintendo.co.kr/media/catalog/product/cache/a7267a3b8c99c74f0bde248fd00edb94/5/5/552c6682f406026678c9acd6f6d5e925c2ff7b75939c478d0d0f43aba553e195.jpg,https://store.nintendo.co.kr/media/catalog/product/cache/a7267a3b8c99c74f0bde248fd00edb94/7/f/7f4032617a7e89b1dad5e5cf89e1d4a74e675a715286592b855697b233e708ad.jpg,https://store.nintendo.co.kr/media/catalog/product/cache/a7267a3b8c99c74f0bde248fd00edb94/3/8/38e4a692ad9c1d2cad145f9aca238edfa4c3eb0af29da1995c11b6613d7bf744.jpg",액션,switch
https://store.nintendo.co.kr/70010000079160,FANTASIAN Neo Dimension,2024-12-05,https://store.nintendo.co.kr/media/catalog/product/cache/a7267a3b8c99c74f0bde248fd00edb94/e/7/e77561ac80333312a307ca0b3de4492ffc69c2a516d761bab488e895787ce188.jpg,"예약구입 상품입니다.

동료들과 함께 기억을 찾아 여행을 떠나자. skill trajectories를 조작해 배틀을 펼치는 새로운 차원의 정통 RPG.
세계는 인간의 감정과 생명을 빼앗는 죽음의 구체―― 「Mechteria」에게 서서히 좀먹히고 있었다.
주인공 Leo는 기계로 가득한 낯선 곳에서 눈을 뜬다.
이곳이 대체 어디인지, 자신이 왜 이곳에 있는지, 아무것도 떠오르지 않는 Leo.
그는 기억을 잃은 상태였다.

Mechteria에게 위협받는 인간의 세계,
수수께끼로 가득한 기계의 세계,
그리고 지금껏 보지 못한 새로운 차원.

남겨진 「Warp Device」를 이용해
Leo는 잃어버린 기억을 찾아 차원을 넘나드는 여행을 떠난다.",FANTASIAN Neo Dimension,Square Enix,"https://store.nintendo.co.kr/media/catalog/product/cache/a7267a3b8c99c74f0bde248fd00edb94/e/7/e77561ac80333312a307ca0b3de4492ffc69c2a516d761bab488e895787ce188.jpg,https://store.nintendo.co.kr/media/catalog/product/cache/a7267a3b8c99c74f0bde248fd00edb94/9/9/99efa82ee0589f0b6145ecfa3b0252b2b0865c6f975ac731d08b3fcc36972705.jpg,https://store.nintendo.co.kr/media/catalog/product/cache/a7267a3b8c99c74f0bde248fd00edb94/5/3/539c16ecb030ddcccde74233c2138fb6fca6f6a881108e8f9195dfe356418d47.jpg,https://store.nintendo.co.kr/media/catalog/product/cache/a7267a3b8c99c74f0bde248fd00edb94/1/e/1ed4b8cb949ede297ec78adffc873c78bd1f831bc6c02193780eb3bcb2818885.jpg,https://store.nintendo.co.kr/media/catalog/product/cache/a7267a3b8c99c74f0bde248fd00edb94/1/a/1ae34872739b88f27c4e24afb4e9825164ac59d35095424a8f7be1e002fda478.jpg,https://store.nintendo.co.kr/media/catalog/product/cache/a7267a3b8c99c74f0bde248fd00edb94/7/a/7a0d83b41c483224a56510cb3d4dcce5a72f18fcb8b2c59c18e40a03d7eab9dd.jpg,https://store.nintendo.co.kr/media/catalog/product/cache/a7267a3b8c99c74f0bde248fd00edb94/e/7/e77561ac80333312a307ca0b3de4492ffc69c2a516d761bab488e895787ce188.jpg","RPG,전략",switch
https://store.nintendo.co.kr/70010000077712,DRAGON QUEST III HD-2D Remake,2024-11-14,https://store.nintendo.co.kr/media/catalog/product/cache/a7267a3b8c99c74f0bde248fd00edb94/c/7/c78d0dd459a5056c54f89ff155cbef377acbc83982ce0b515390cf79245640bb.jpg,"예약구입 상품입니다.

여기부터 전설이 시작된다
수많은 게임 팬에게 사랑받는 불후의 명작 『드래곤 퀘스트 III 전설의 시작』이 새로운 그래픽으로 다시 태어난다. 도트와 3D CG가 융합된 아름다운 HD-2D 세계에서 장대한 모험을 떠나자!

■스토리
작은 나라 아리아한의 용감한 전사 오르테가의 아들인 주인공은
16살 생일을 맞은 날, 왕으로부터 중대한 사명을 듣는다.
그것은 죽은 오르테가의 유지를 이어 어둠의 나라에서 나타난 마왕 바라모스를 퇴치하는 것.
세계를 구하기 위해 여행을 떠난 주인공을 기다리고 있었던 놀라운 운명이란......?!

■함께 모험을 떠나는 동료들
동료를 찾는 여행자들이 모이는 장소 「루이다 주점」에서는
주인공과 함께 모험을 떠나는 동료를 최대 3명까지 데리고 갈 수 있다.
동료는 다양한 특징을 가진 직업 중에서 선택할 수 있으며, 외형과 머리색, 목소리 등을 원하는 대로 커스터마이즈할 수 있다.
또한, 본 작품에서는 새로운 직업 「마물 조련사」가 추가!

■모험의 무대
광대한 필드에는 마을과 성 외에도 동굴, 탑 등의 던전이 존재한다.
여행 도중에 배와 같은 탈것을 획득하면 바다와 강을 자유롭게 건널 수 있게 되며, 모험할 수 있는 범위가 크게 확장된다.

■몬스터와 펼치는 배틀
「드래곤 퀘스트」 시리즈의 대표적인 턴제 커맨드 배틀로 몬스터와 치열한 전투를 펼쳐라!
주인공과 동료들은 무기 공격 외에도 직업과 레벨에 맞는 다양한 효과를 가진 주문과 특기를 사용할 수 있다.
몬스터를 쓰러뜨리고 얻을 수 있는 경험치와 골드로 주인공 일행을 더욱 강화시키자.","DRAGON QUEST III HD-2D Remake,드래곤 퀘스트 III HD-2D Remake",Square Enix,"https://store.nintendo.co.kr/media/catalog/product/cache/a7267a3b8c99c74f0bde248fd00edb94/c/7/c78d0dd459a5056c54f89ff155cbef377acbc83982ce0b515390cf79245640bb.jpg,https://store.nintendo.co.kr/media/catalog/product/cache/a7267a3b8c99c74f0bde248fd00edb94/c/b/cbfcfd84516db6b30f6c91a5e1c4ce1f16570ede8bb4c6b0d2c05c0a6ea956be.jpg,https://store.nintendo.co.kr/media/catalog/product/cache/a7267a3b8c99c74f0bde248fd00edb94/f/b/fb65e56d6db28e421b8651add944d205247c620da0324129749b7ebc04ee5ef2.jpg,https://store.nintendo.co.kr/media/catalog/product/cache/a7267a3b8c99c74f0bde248fd00edb94/7/e/7e4b87e383358a9afa18eeea22984ff6abc496dd31e6031d2ec62c6d945aa532.jpg,https://store.nintendo.co.kr/media/catalog/product/cache/a7267a3b8c99c74f0bde248fd00edb94/0/7/072f1df83bc92af0ae273cd86c2ad2b48ae4bd07a5cf54d41bd3e24e38c3b0fd.jpg,https://store.nintendo.co.kr/media/catalog/product/cache/a7267a3b8c99c74f0bde248fd00edb94/e/f/efe09d788a4c602f7a6dc25d61049e8973a9398554b0f61420a1b3f0cb22b859.jpg",RPG,switch
https://store.nintendo.co.kr/70010000084615,마리오&루이지 RPG 브라더십!,2024-11-07,https://store.nintendo.co.kr/media/catalog/product/cache/a7267a3b8c99c74f0bde248fd00edb94/3/d/3dd1141917a1394554b25a97193c7ae82f3f578cf8d69eb8ed0d9fe71892b84c.jpg,"현재 닌텐도 e숍에서 예약판매 중입니다.
닌텐도 온라인 스토어에서의 판매는 후일 실시 예정입니다.

드넓은 바다에 떠 있는 섬들을 배경으로 마리오와 루이지의 새로운 모험이 시작됩니다.
모험의 무대는 버섯 왕국과는 다른 세계에 있는 「커넥탈랜드」.

마리오와 루이지가 힘을 합쳐, 곳곳에 그들을 기다리고 있는 다양한 함정을 헤쳐 나갑니다.
커넥탈랜드에서는 마리오 일행을 도와주는 인물부터 앞길을 가로막는 심상치 않은 인물까지, 다양한 만남이 기다리고 있습니다.
그 밖에도 버섯 왕국의 공주님이나 거북족의 대마왕 등, 마리오 시리즈의 단골 멤버들도 등장합니다.

전투에서는 마리오다운 액션 요소가 가미된 커맨드 배틀을 즐길 수 있습니다.
공격할 때 특정 버튼을 정확한 타이밍에 맞춰서 누르면 적에게 주는 대미지가 늘어나고, 강력한 「브라더 어택」을 성공시킬 수도 있습니다.
방어할 때에도 정확한 타이밍에 맞춰 버튼을 누르면, 적의 공격을 회피하거나 반격할 수 있습니다.",마리오&루이지 RPG 브라더십!,Nintendo,"https://store.nintendo.co.kr/media/catalog/product/cache/a7267a3b8c99c74f0bde248fd00edb94/3/d/3dd1141917a1394554b25a97193c7ae82f3f578cf8d69eb8ed0d9fe71892b84c.jpg,https://store.nintendo.co.kr/media/catalog/product/cache/a7267a3b8c99c74f0bde248fd00edb94/1/b/1bb801b7ba767eb330a205f6a7a73043da3f4a33c26a3edfae4388a0ebc08a16.jpg,https://store.nintendo.co.kr/media/catalog/product/cache/a7267a3b8c99c74f0bde248fd00edb94/6/e/6ec42e2d701fe685ab8d67e44e5378b2cf7d39ae93812148b90ffa4909ed4514.jpg,https://store.nintendo.co.kr/media/catalog/product/cache/a7267a3b8c99c74f0bde248fd00edb94/a/2/a2d1945ab2e65203b65b09f9a885cdb8c992f6997cb8fa1241a152a3ae7a2a77.jpg,https://store.nintendo.co.kr/media/catalog/product/cache/a7267a3b8c99c74f0bde248fd00edb94/3/c/3c1789ca191a661bf319da38fef895f71670ff61d44e36ba3cea51afea3f83c8.jpg,https://store.nintendo.co.kr/media/catalog/product/cache/a7267a3b8c99c74f0bde248fd00edb94/9/1/91d9cb71e7deb577fc38792de602a82ff95748e44b3ae1b3fec867644298a50d.jpg,https://store.nintendo.co.kr/media/catalog/product/cache/a7267a3b8c99c74f0bde248fd00edb94/d/1/d19a52ec89a87ada0dd8aad0c4c39fc80767e076ddd0f91090c60e000a51d776.jpg","액션,RPG,어드벤처",switch
https://store.nintendo.co.kr/70010000083082,Shadows of the Damned: Hella Remastered,2024-10-31,https://store.nintendo.co.kr/media/catalog/product/cache/a7267a3b8c99c74f0bde248fd00edb94/1/a/1a6a97252f28f86851576302d57c7435a2fd0370c2b30360da62470c0cedd1ae.jpg,"예약구입 상품입니다.

악마 사냥꾼 가르시아 핫스퍼가 되어 악마를 흠씬 두들겨 패봅시다. 지하 세계의 제왕으로부터 사랑하는 여자를 되찾기 위해 고군분투하는 열혈남 가르시아에 비하면 지옥의 불길은 그저 차가울 뿐이죠.

- 들끓는 열정, 지옥 같은 뒤틀림, 엄청난 추잡함, 사랑과 증오로 가득 찬 로드 트립.
지하 세계의 제왕 플레밍의 손아귀에 납치된 가르시아의 연인 파올라를 되찾기 위해 지하 세계 깊은 곳을 누비는 무신경한 가르시아 핫스퍼와 그의 해골 친구 존슨의 여정에 합류하세요. 지하 세계의 중심부에서 펼쳐지는 뒤틀린 지옥의 풍경 속에서 울려 퍼지는 로큰롤 스피릿을 자유롭게 즐겨보세요.

- 빛과 어둠의 힘으로 펑키함이 넘치는 던전을 통과하라.
여러분은 빛과 어둠의 힘을 받아 앞으로 나아갑니다. 나이트클럽 속 파티광처럼, 악마들은 어둠 속에서는 대담하지만 빛에 노출되면 약해지죠. 친구인 존슨을 이용해 지하 세계의 어둠을 뚫고 나아가세요.

- 리마스터 한정 새로운 콘텐츠
완전히 새로운 코스튬 4종: 근사한 옷을 입고 스타일리시하게 악마를 혼쭐내세요.
첫 플레이가 끝나면 뉴 게임 플러스로 진행도를 유지한 채 지하 세계에서 마음껏 분노를 표출하세요.

- 업계에서 가장 창의적인 인재들이 탄생시킨 컬트 클래식.
업계에서 전설로 불리는 스다 고이치(No More Heroes, Killer7 등)
그리고 미카미 신지(Resident Evil, God Hand 등)가 만든 3인칭 슈팅 게임",Shadows of the Damned: Hella Remastered,Grasshopper Manufacture,"https://store.nintendo.co.kr/media/catalog/product/cache/a7267a3b8c99c74f0bde248fd00edb94/1/a/1a6a97252f28f86851576302d57c7435a2fd0370c2b30360da62470c0cedd1ae.jpg,https://store.nintendo.co.kr/media/catalog/product/cache/a7267a3b8c99c74f0bde248fd00edb94/c/5/c5f42fd55b744f05d34d8026c08d436c389717b67b0d813a7d81e180e0c0881f.jpg,https://store.nintendo.co.kr/media/catalog/product/cache/a7267a3b8c99c74f0bde248fd00edb94/7/5/7581bc245f9e58ac142799f09a379ee153c993dca3fae49e05949a41cd13d417.jpg,https://store.nintendo.co.kr/media/catalog/product/cache/a7267a3b8c99c74f0bde248fd00edb94/f/b/fbaaca83c972142b318a6406b2d1f1941500cae56ba9abc2c50ab72dfee019ee.jpg,https://store.nintendo.co.kr/media/catalog/product/cache/a7267a3b8c99c74f0bde248fd00edb94/0/f/0ff5b73c0c119da961637df66dbd6d515b635921249e9bde288e822641cf517b.jpg,https://store.nintendo.co.kr/media/catalog/product/cache/a7267a3b8c99c74f0bde248fd00edb94/6/8/6858286ca6ca36ad13ea2e7ffc1e3268ebc7087858c8f6f76694eb758be63540.jpg,https://store.nintendo.co.kr/media/catalog/product/cache/a7267a3b8c99c74f0bde248fd00edb94/f/b/fb6f198a9d4564d8f81c20acd41eb98554f48fc077ab6ed782a50f81a0bb2642.jpg","액션,어드벤처",switch
