title,url,date,imageurl,description,autokwd,company,screenshot,tag,platform
슈퍼 몽키 볼 바나나 럼블（Super Monkey Ball Banana Rumble）,https://store.nintendo.co.kr/70010000057429,2024-06-25,https://store.nintendo.co.kr/media/catalog/product/cache/8e3c84988db1fdb90470f4d01453d879/b/c/bc1fa3b0b04f0540a2a9d718e213e939fcfc8d3c9d1629ae178c14451bcc279a_1708416738.jpg,"예약구입 상품입니다.
구르기 시작하면 멈출 수 없다!?
우당탕탕 왁자지껄 파티 엔터테인먼트!
원숭이가 들어있는 볼을 굴려 골을 목표로 하는 심플 & 신나는 액션 게임 등장!
깜찍한 원숭이 아이아이와 그 친구들, 그리고 전 세계의 플레이어와 함께 신나게 놀자!

레이스, 점수 대결 등 다양한 룰로 대전할 수 있는 배틀 모드가 본 타이틀에서 새롭게 등장! 최대 16인까지 참여할 수 있는 온라인 멀티 플레이도 지원.
또한 어드벤처 모드에서는 개성 넘치는 200종류의 신규 스테이지가 등장! 최대 4인 멀티 플레이로 친구와 협력하며 스테이지를 공략하는 것도 가능!
다 함께 떠들썩한 멀티 플레이부터 여유 있게 즐기는 싱글 플레이까지, '슈퍼 몽키 볼 바나나 럼블'의 세계에 마음껏 빠져보자!

【본 타이틀의 특징】
・최대 16인의 온라인 멀티 플레이, 최대 4인의 로컬 멀티 플레이를 다 함께 즐기자!
・'전설의 바나나'를 찾아서, 아이아이 일행이 200종류의 신규 스테이지에서 모험을 펼친다!
・자신만의 원숭이로 개성을 뽐내자! 300가지가 넘는 코디 파츠로 캐릭터 코디를 내 마음대로.
・간단한 조작으로 스릴 만점! 물론, 도전 의식을 자극하는 요소 또한 알차게!
・새로운 액션 '스핀 대시'로 라이벌을 제치고 승리를 향해 달려라!
알림
이 소프트웨어에는 인터넷에 접속할 수 있는 환경과, Nintendo Switch Online 가입(유료)이 필요한 모드나 기능이 있습니다.
【예약 특전(다운로드판 예약 특전 및 패키지판 조기 구매 특전) 내용】
・바나나 인형옷

※특전이 포함되는 기간은 2024년 6월 24일 23:59까지입니다.",슈퍼 몽키 볼 바나나 럼블（Super Monkey Ball Banana Rumble）,SEGA,"https://store.nintendo.co.kr/media/catalog/product/cache/8e3c84988db1fdb90470f4d01453d879/b/c/bc1fa3b0b04f0540a2a9d718e213e939fcfc8d3c9d1629ae178c14451bcc279a_1708416738.jpg,https://store.nintendo.co.kr/media/catalog/product/cache/8e3c84988db1fdb90470f4d01453d879/b/c/bc1fa3b0b04f0540a2a9d718e213e939fcfc8d3c9d1629ae178c14451bcc279a_1708416738.jpg,https://store.nintendo.co.kr/media/catalog/product/cache/8e3c84988db1fdb90470f4d01453d879/4/e/4e4dc0692342db8f8aff5e1d8ee894a7c1c6b79ce3c1306d56eda151c19c4a43_1708416738.jpg,https://store.nintendo.co.kr/media/catalog/product/cache/8e3c84988db1fdb90470f4d01453d879/d/1/d12ffb2c722e2c3b23c413a28a3a4487e0b22dbc5ca085d58fadca5404801c7c_1708416738.jpg,https://store.nintendo.co.kr/media/catalog/product/cache/8e3c84988db1fdb90470f4d01453d879/2/c/2cd89ee8404e39004db2828a8357eeeb8e04e028c01ea154aaa7c31c8f3e3fd5_1708416738.jpg,https://store.nintendo.co.kr/media/catalog/product/cache/8e3c84988db1fdb90470f4d01453d879/2/c/2c5c35a20182a9ca8f24f2d637bef34622cb74678ab9154baa5e21f6d8b0f986_1708416738.jpg,https://store.nintendo.co.kr/media/catalog/product/cache/8e3c84988db1fdb90470f4d01453d879/8/3/835a12c158345a791ebdfb320109179390135ed4ad2ff6eafc0a59b69284344e_1708416738.jpg","액션,파티,아케이드,퍼즐",switch
네모난 지구에 또다시 적이 나타났다고!? 디지복셀 지구방위군 2,https://store.nintendo.co.kr/70010000073734,2024-05-23,https://store.nintendo.co.kr/media/catalog/product/cache/8e3c84988db1fdb90470f4d01453d879/0/e/0e32d06b8a461c72c74d3761c48b6ecf26a40a67e493e9c6061ade4edc317b78_1709194335.jpg,"예약구입 상품입니다.
또 지구가 산산조각 난 거야!? 다시 지구를 구해라~!
스탠더드 에디션의 구성:
・네모난 지구에 또다시 적이 나타났다고!? 디지복셀 지구방위군 2

게임 설명
또 지구가 산산조각 난 거야!? 다시 지구를 구해라~!

●거대한 적의 가차 없는 습격
네모난 지구에 거대한 적의 대량 습격. 거대 개미, 거대 거미, 거대 벌, 거대 전갈, 거대 UFO, 거대 기계, 거대 괴수… 설상가상으로 거대 우주인에 거대 EDF 병사까지 몰려드는 절망스러운 상황. 그렇지만 끝없이 습격해 오는 적을 쓰러뜨릴 때의 상쾌함은 각별하다.

●나만의 EDF 부대를 편성
전 세계에 흩어진 대원들을 구출해서 동료로 맞이하자. 모은 동료를 4명 선택해 팀을 편성. 자신의 전투 스타일에 맞는 부대를 만들어 장비를 선택하면 출격 준비 완료. 모을 수 있는 동료는 100인 이상!

●역대 병과가 총집결
넘버링 EDF 작품은 물론 스핀오프 작품에 등장한 병과까지 총집결. 추억 속 그 병사와 넘버링 최신작 「지구방위군 6」의 병과도 등장. 장비 가능한 무기와 액세서리를 600종 이상 수록.

●익숙한 적들의 등장!
지금까지 지구를 괴롭혔던 침략자들도 세계선을 넘어 속속 참전. 복셀 디자인으로 어레인지된 ""그"" 적과 ""이"" 적, 그리고 새로운 적이 다수 등장. 100종 이상의 미션과 5개 난이도가 마련되어 있다.

●온라인 협력 플레이 & 로컬 통신 플레이 대응
최대 4인까지 온라인 협력 플레이 대응. 또한 Nintendo Switch™ 버전 전용 기능으로 로컬 통신 플레이에도 대응한다. 가족, 친구와 함께 사이좋게 지구를 지키자.

~이야기~
침략자 다크 레지온을 쓰러뜨리고 평화를 되찾은 네모난 지구가 또다시 산산조각났다.
적은 우주에서 올 것이라고 여기고 하늘만 경계하고 있었는데, 땅속에서 나타난 대형 거인 가이아크가 지구를 산산조각 내고 말았다.
당신은 과거 지구를 구한 전설의 커맨더. 다시 한번 팀을 지휘하며 적에게 맞서 지구를 구하라.
동그랗든 네모나든 지구라면 뭐든지 지키는 것이 EDF. 자, 출격이다!
알림
이 소프트웨어에는 인터넷에 접속할 수 있는 환경과, Nintendo Switch Online 가입(유료)이 필요한 모드나 기능이 있습니다.
【예약 특전】(2024년 5월 22일 23:59까지)
・위드 브라더~ 「히메카와 공보관」
・10% 할인
【조기 구입 특전】(2024년 9월 30일 23:59까지)
・걱정 마세요 「혼다 공보관」 참전",네모난 지구에 또다시 적이 나타났다고!? 디지복셀 지구방위군 2,Clouded Leopard Entertainment,"https://store.nintendo.co.kr/media/catalog/product/cache/8e3c84988db1fdb90470f4d01453d879/0/e/0e32d06b8a461c72c74d3761c48b6ecf26a40a67e493e9c6061ade4edc317b78_1709194335.jpg,https://store.nintendo.co.kr/media/catalog/product/cache/8e3c84988db1fdb90470f4d01453d879/0/e/0e32d06b8a461c72c74d3761c48b6ecf26a40a67e493e9c6061ade4edc317b78_1709194335.jpg,https://store.nintendo.co.kr/media/catalog/product/cache/8e3c84988db1fdb90470f4d01453d879/0/5/05df48b1e04e1ba2493a03af43aa76c321bfd13557162e2d27661ebb547bf280_1709194335.jpg,https://store.nintendo.co.kr/media/catalog/product/cache/8e3c84988db1fdb90470f4d01453d879/2/c/2ca4838f5c246d64655f732f6a8634509a1c07f22c2c3856926e1d8bd2a09580_1709194335.jpg,https://store.nintendo.co.kr/media/catalog/product/cache/8e3c84988db1fdb90470f4d01453d879/a/0/a06d5a7fd1ea56228c0db7fd8cd54d5af08a66042fa61c1b7a9ac2c13eb3b28e_1709194335.jpg,https://store.nintendo.co.kr/media/catalog/product/cache/8e3c84988db1fdb90470f4d01453d879/e/2/e228771542a924246c9111033e54355e8076baaf09244fe9e7f6d026f3f7ea34_1709194335.jpg,https://store.nintendo.co.kr/media/catalog/product/cache/8e3c84988db1fdb90470f4d01453d879/2/b/2b70aa57e955d7f8e1ba9d601ef178f225097664656f545d246c49d15daac747_1709194335.jpg","액션,슈팅",switch
Biomutant,https://store.nintendo.co.kr/70010000075289,2024-05-14,https://store.nintendo.co.kr/media/catalog/product/cache/8e3c84988db1fdb90470f4d01453d879/4/7/47d7fb30e0c7116217504e7d5b01b31b8b33e62cb69c4a55b941d8e780b431e1_1709108082.jpg,"예약구입 상품입니다.
BIOMUTANT®는 종말 이후의 세상을 우화로 그려낸 쿵후 RPG입니다. 독특한 무술과 세련된 전투 시스템을 통해, 근접 전투 및 원거리 전투, 그리고 변이 능력까지 모두 어우러진 액션을 경험해 보세요.

역병이 대지를 집어삼키고 생명의 나무도 뿌리째 시들어가고 있습니다. 거기에 부족마저 분열된 상황입니다. 혼란에 빠진 세계를 탐험하면서 그 운명을 결정하십시오. 당신은 세상을 구원할 수 있겠습니까? 아니면 더욱더 끔찍한 결말로 인도하시겠습니까?

주요 특징
- 근접 및 원거리 전투, 변이 능력을 조합해 가며 극한의 자유를 경험하십시오.
- 유전자 구조를 변경하여 외모를 바꾸거나, 거북의 형상 혹은 점액 거품 따위의 변이 능력을 활용할 수도 있습니다.
- 도보로 돌아다니거나 메크, 제트 스키, 열기구 등 지역별로 배치된 독특한 탈것에 올라탄 뒤 생기 넘치는 오픈 월드를 탐험하십시오.
- 여러 부품을 조합하여 적을 베고, 으스러뜨리고, 찌를 수 있는 자신만의 근접 무기를 만들어 보세요. 리볼버, 소총, 산탄총 등, 얼마든지 제작할 수 있습니다.
- 모든 과정에 진행자의 내레이션이 함께 합니다. 하지만 당신의 생과 사, 그리고 스토리가 어떻게 마무리될지는 각 순간의 행동과 어떤 선택을 했느냐에 달려 있습니다.

무료 용병 무장 DLC 포함: 용병은 특별합니다. 두 손으로 무기를 사용하는 시작 능력과 클래식한 블레이드를 가지고 있죠. 그래서 BIOMUTANT를 시작부터 사무라이 스타일로 즐길 수 있습니다.",Biomutant,THQ Nordic Japan,"https://store.nintendo.co.kr/media/catalog/product/cache/8e3c84988db1fdb90470f4d01453d879/4/7/47d7fb30e0c7116217504e7d5b01b31b8b33e62cb69c4a55b941d8e780b431e1_1709108082.jpg,https://store.nintendo.co.kr/media/catalog/product/cache/8e3c84988db1fdb90470f4d01453d879/4/7/47d7fb30e0c7116217504e7d5b01b31b8b33e62cb69c4a55b941d8e780b431e1_1709108082.jpg,https://store.nintendo.co.kr/media/catalog/product/cache/8e3c84988db1fdb90470f4d01453d879/e/0/e03e12392d078add8e0a1cdfc4bcacbb3cef4097231121bfb635330176fae884_1709108082.jpg,https://store.nintendo.co.kr/media/catalog/product/cache/8e3c84988db1fdb90470f4d01453d879/8/4/8465d63441e27ee9755c710714981e512857a8c79434a019510769c4a8c2740d_1709108082.jpg,https://store.nintendo.co.kr/media/catalog/product/cache/8e3c84988db1fdb90470f4d01453d879/9/6/965d206d4728b53cc6d3322e0866b0f81f8eedcab8d9539b013a2a36ec2e1338_1709108082.jpg,https://store.nintendo.co.kr/media/catalog/product/cache/8e3c84988db1fdb90470f4d01453d879/1/2/12420c8f6bfbcc48d45bfc1b0026ead432aa931fe3215f13936a073aedd2e77f_1709108082.jpg,https://store.nintendo.co.kr/media/catalog/product/cache/8e3c84988db1fdb90470f4d01453d879/5/2/52e8e744b633e8896e66361d0f943f07b886871758940b590b5a627496ed37fe_1709108082.jpg","액션,RPG,어드벤처",switch
Gift,https://store.nintendo.co.kr/70010000072415,2024-05-09,https://store.nintendo.co.kr/media/catalog/product/cache/8e3c84988db1fdb90470f4d01453d879/7/2/72768382c9633785d620f99fc920bdd455ac28852463758e5866597a167123e0_1709108015.jpg,"예약구입 상품입니다.
잠에서 깨어난 한 노인은 자신이 호화 유람선에 타고 있음을 깨닫습니다.
침몰하는 배 안에서 탈출을 시도하는 동안 노인은 다양한 이유로 향수를 불러일으키는 승객들을 만나게 되는데...

거대한 유람선이 바다에 가라앉기 전에 탈출하는 것을 목표로 하는 액션 게임입니다.
배의 기울기와 수위가 끊임없이 변화하므로 같은 장소더라도 타이밍에 따라 상황이 크게 달라질 수 있습니다.
배 곳곳에 있는 장치 또한 기울기와 수위에 따라 매우 다르게 작용합니다.
플레이어는 탈출 경로를 만들기 위해 이러한 변화 요소를 전략적으로 활용해야 합니다. 때에 따라서는 퍼즐을 풀거나 캐릭터의 움직임을 잘 조작할 필요도 있습니다.

그리고 그 끝에는…
매우 소중한 만남이 노인을 기다리고 있습니다.",Gift,Bushiroad,"https://store.nintendo.co.kr/media/catalog/product/cache/8e3c84988db1fdb90470f4d01453d879/7/2/72768382c9633785d620f99fc920bdd455ac28852463758e5866597a167123e0_1709108015.jpg,https://store.nintendo.co.kr/media/catalog/product/cache/8e3c84988db1fdb90470f4d01453d879/7/2/72768382c9633785d620f99fc920bdd455ac28852463758e5866597a167123e0_1709108015.jpg,https://store.nintendo.co.kr/media/catalog/product/cache/8e3c84988db1fdb90470f4d01453d879/4/4/44607edff8d8f611636a9c50c9e4962921e5cba522d8b44b72aaebe58c582081_1709108015.jpg,https://store.nintendo.co.kr/media/catalog/product/cache/8e3c84988db1fdb90470f4d01453d879/c/e/ce86e8629b454d7cb39a9bd464079fd23d1e97a8603ccb53f7a7e85e301fe47b_1709108015.jpg,https://store.nintendo.co.kr/media/catalog/product/cache/8e3c84988db1fdb90470f4d01453d879/5/2/52b1e5d218ca9d070cb6c6cae245300a4cbac339cbaf89bd84532a54c6f8aa1c_1709108015.jpg,https://store.nintendo.co.kr/media/catalog/product/cache/8e3c84988db1fdb90470f4d01453d879/2/9/29536ceb97d4ba1f24699620d035f01061f85812b5f49f551861ebec98888585_1709108015.jpg,https://store.nintendo.co.kr/media/catalog/product/cache/8e3c84988db1fdb90470f4d01453d879/6/3/63e7a62447f936a3c8ae16273189a9d14c8dc1246524bf896660c7c4da0e2dea_1709108015.jpg","액션,어드벤처,퍼즐",switch
포에버 블루 루미너스,https://store.nintendo.co.kr/70010000077707,2024-05-02,https://store.nintendo.co.kr/media/catalog/product/cache/8e3c84988db1fdb90470f4d01453d879/5/6/56d89827b0d497bbb68fdedfd42c50a4d4b0d3c0ec6d1ab9872837f459d7b6f8_1708503344.jpg,"현재 닌텐도 e숍에서 예약판매 중입니다.
닌텐도 온라인 스토어에서의 판매는 후일 실시 예정입니다.
신비로운 수중 세계를 탐색하는 다이빙 어드벤처 『포에버 블루 루미너스』가 Nintendo Switch로 등장!
무대는 극히 일부의 다이버에게만 알려진 「베일드해」. 잠수할 때마다 다른 모습을 보여주는 신비의 해역입니다.

이번 작품은 최대 30명까지 참여하는 온라인 플레이에 대응하고 있으며, 각자가 모은 정보를 공유하거나, 다이버끼리 커뮤니케이션하면서 마음껏 바닷속을 탐색해 나갈 수 있습니다.

만날 수 있는 생물은 500종류 이상. 그중에는 멸종한 것으로 알려진 생물이나, 환상의 생물이 있을지도…?
알림
이 소프트웨어에는 인터넷에 접속할 수 있는 환경과, Nintendo Switch Online 가입(유료)이 필요한 모드나 기능이 있습니다.
구입특전 「Nintendo Switch Online 7일간 무료 체험 번호」
 ・패키지 버전은 소프트웨어 안에 동봉되어 있습니다.
 ・다운로드 버전은 구입한 분에게 메일로 송부드립니다.
 ※본 소프트웨어를 다운로드 번호로 교환하신 분도 대상입니다.
 ※예약 구입하신 분은 2024년 4월 26일 이후에 메일로 송부드립니다.",포에버 블루 루미너스,한국닌텐도,"https://store.nintendo.co.kr/media/catalog/product/cache/8e3c84988db1fdb90470f4d01453d879/5/6/56d89827b0d497bbb68fdedfd42c50a4d4b0d3c0ec6d1ab9872837f459d7b6f8_1708503344.jpg,https://store.nintendo.co.kr/media/catalog/product/cache/8e3c84988db1fdb90470f4d01453d879/5/6/56d89827b0d497bbb68fdedfd42c50a4d4b0d3c0ec6d1ab9872837f459d7b6f8_1708503344.jpg,https://store.nintendo.co.kr/media/catalog/product/cache/8e3c84988db1fdb90470f4d01453d879/b/c/bc6b611e2db54a92a7d4f4058d374477a7dd906d88dde185598d0b87dc6c1021_1708503344.jpg,https://store.nintendo.co.kr/media/catalog/product/cache/8e3c84988db1fdb90470f4d01453d879/8/d/8d307b05ffe078550f1a9b9a7177bf0e517acb0e3c6d7ed7fbe98fd8eeeebb21_1708503344.jpg,https://store.nintendo.co.kr/media/catalog/product/cache/8e3c84988db1fdb90470f4d01453d879/c/d/cd63addec722cd666727c9adee16fdfd8391fe216c74745f803d540696856b31_1708503344.jpg,https://store.nintendo.co.kr/media/catalog/product/cache/8e3c84988db1fdb90470f4d01453d879/0/f/0f08909638f2dc441c3597db8a884184599eb60f9f7d6ea7f807bef4bfca747e_1708503344.jpg",어드벤처,switch
El Shaddai ASCENSION OF THE METATRON HD Remaster,https://store.nintendo.co.kr/70010000057899,2024-04-28,https://store.nintendo.co.kr/media/catalog/product/cache/8e3c84988db1fdb90470f4d01453d879/5/4/54aab6aec16f0682a93edbd1aeff5ca82d5ae05dfeca83f1d992a61c4dba376e_1705911083.jpg,"예약구입 상품입니다.
한 번쯤 들어본 숨겨진 명작!
재미의 정수를 가득 담은 화제의 액션게임.
엘 샤다이가 Full HD로 닌텐도 스위치에 등장!
◆끊임없이 변화하는 질리지 않는 비주얼 체험!
""계속 변화하는 세계""와 ""누구나 좋아하는 화면""을 키워드로 구현한 회화 같은 비주얼 표현, 디자인, 세계관을 즐겨보세요. 살아 움직이는 듯 끝없이 변하는 혁신적이고 독창적인 비주얼이 향수를 자극합니다.

◆간단한 조작으로 체감하는 박력 넘치는 액션!
공격, 점프, 방어, 무기 빼앗기 단 4개의 버튼만으로 게임을 즐기세요.
조작이 쉬워 설명서가 없어도 누구나 즐길 수 있습니다. 간단하지만, 타이밍, 동시 입력, 딜레이, 연타 등, 다양한 입력 방법을 활용해 박진감 넘치는 플레이를 즐길 수 있습니다.
""간단하지만 심오한"" 게임성을 느껴보세요.

◆추가 요소
본 게임은 Full HD를 지원하며 로딩 시간 단축 및 최적화 작업이 진행되었습니다.
또한, 추가 특전으로 클리어 이후의 스토리를 풀어낸 특전 소설 '-루시펠의 타락- 세타기'와 El Shaddai ASCENSION OF THE METATRON ArtBook을 수록하고 있습니다.",El Shaddai ASCENSION OF THE METATRON HD Remaster,crim,"https://store.nintendo.co.kr/media/catalog/product/cache/8e3c84988db1fdb90470f4d01453d879/5/4/54aab6aec16f0682a93edbd1aeff5ca82d5ae05dfeca83f1d992a61c4dba376e_1705911083.jpg,https://store.nintendo.co.kr/media/catalog/product/cache/8e3c84988db1fdb90470f4d01453d879/5/4/54aab6aec16f0682a93edbd1aeff5ca82d5ae05dfeca83f1d992a61c4dba376e_1705911083.jpg,https://store.nintendo.co.kr/media/catalog/product/cache/8e3c84988db1fdb90470f4d01453d879/7/5/75f266146603d41150b68693d91dc0f5328f5ac72edfb17f16f682b2d0fbaa98_1705911083.jpg,https://store.nintendo.co.kr/media/catalog/product/cache/8e3c84988db1fdb90470f4d01453d879/e/a/ea39c827ba456317e1bb5818e1a72fdccd5361112e95aef2a588608c6dee082e_1705911083.jpg,https://store.nintendo.co.kr/media/catalog/product/cache/8e3c84988db1fdb90470f4d01453d879/a/1/a1f2021d13b935b2cb745c3a58ce8c596f037a441c6b50593f710dc69252ce6e_1705911083.jpg,https://store.nintendo.co.kr/media/catalog/product/cache/8e3c84988db1fdb90470f4d01453d879/e/8/e8417efd677b6278ba9842cba0143a6c5666ba4096f159f1f3f5489de24a686f_1705911083.jpg,https://store.nintendo.co.kr/media/catalog/product/cache/8e3c84988db1fdb90470f4d01453d879/0/c/0cf51f8a2479faf60cd24469cc0df936329dd672db3b16552120bbabdc651336_1705911083.jpg",액션,switch
Let's! Revolution!,https://store.nintendo.co.kr/70010000072517,2024-04-11,https://store.nintendo.co.kr/media/catalog/product/cache/8e3c84988db1fdb90470f4d01453d879/3/8/381cdfb73e1b6e0bf7c37bb0ebc2c6846c058b11b06fe3e2c7dbcf80d22762ec_1709626265.jpg,"예약구입 상품입니다.
지뢰 찾기에서 영감을 받은 이 다채로운 로그라이크 퍼즐 매시업에서 연역적 추론과 턴제 전술 능력을 발휘해 보세요!
Let’s! Revolution!은 지뢰 찾기의 고전적인 규칙을 기반으로 절차적 미로 생성과 턴제 전술을 통해 구축된 로그라이트 퍼즐 매시업입니다.

매혹적인 분위기의 비봄 시티에서 부패한 왕을 쫓아 치명적인 숨바꼭질 게임을 시작하세요.

타일을 뒤집어 위협적인 적들을 물리치고 강력한 아이템과 능력을 획득하며 문제 해결 능력을 시험해 보세요.

왕에게 아첨하는 사악한 부하들을 영리하게 피하거나 전략적 턴제 전투에서 쓰러뜨리세요.

비봄 시티에서 왕과 맞설 최후의 결전을 위해 100개 이상의 아이템과 능력을 준비해 두세요.

수상 경력에 빛나는 애니메이션 하우스 BUCK의 데뷔 게임에서 아름다운 일러스트와 손으로 그린 애니메이션으로 구현된 비봄 세계에 푹 빠져보세요. Antfood의 오리지널 스코어와 사운드 디자인이 생동감 넘치는 음향으로 비봄에 생생함을 더합니다.

영웅들

각각 고유한 플레이스타일과 능력을 지닌 6가지 개성 넘치는 클래스 중에서 영웅을 선택하세요.

돌격대장은 파괴력 넘치는 공격을 펼치는 대신 에너지를 얻기 위해 숨겨진 타일로 계속 돌격해야 하는 강력한 전사입니다.

은신술사는 연막탄, 수면 다트와 같은 교묘한 아이템을 활용해 적들을 속이고 전략적으로 제압합니다.

예언가는 점점 더 많은 정보를 더해가며 뛰어난 논리와 순간이동으로 미로를 탐색하는 깨달음의 마법 대가입니다.

게임 특징

다양한 캐릭터: 왕과 추종자들부터 모험을 도와주는 가게 주인들까지, 풍부한 표현력의 애니메이션과 유쾌한 대화를 통해 생생하게 살아 움직이는 다양하고 인상적인 캐릭터들을 만나볼 수 있습니다.

단순한 게임플레이: 지루한 계산과 모호한 확률은 이제 그만. 보드게임에서 영감을 받은 메커니즘은 학습 능력과 전략적인 게임플레이에 중점을 둡니다.

고급 난이도: 각 클래스마다 잠금 해제할 수 있는 뉴 게임 플러스 5개 레벨을 통해 전문가 플레이어는 최고 난이도로 실력을 시험해 볼 수 있습니다.

느긋하게 즐기기: 캐주얼 플레이어나 자신만의 속도로 군주제를 전복시키려는 플레이어는 쉬움 모드로 플레이하며 편안한 분위기 속에서 재미를 느낄 수 있습니다.","Let's! Revolution!,가자! 혁명을 위하여! ",Buck,"https://store.nintendo.co.kr/media/catalog/product/cache/8e3c84988db1fdb90470f4d01453d879/3/8/381cdfb73e1b6e0bf7c37bb0ebc2c6846c058b11b06fe3e2c7dbcf80d22762ec_1709626265.jpg,https://store.nintendo.co.kr/media/catalog/product/cache/8e3c84988db1fdb90470f4d01453d879/3/8/381cdfb73e1b6e0bf7c37bb0ebc2c6846c058b11b06fe3e2c7dbcf80d22762ec_1709626265.jpg,https://store.nintendo.co.kr/media/catalog/product/cache/8e3c84988db1fdb90470f4d01453d879/2/2/223b34dbde0a8e93e1527537500ded3a1d766c637dddd62f96375606df7d6ee6_1709626265.jpg,https://store.nintendo.co.kr/media/catalog/product/cache/8e3c84988db1fdb90470f4d01453d879/7/e/7ec50d1a40acfb02b9f6fa5c67d7d89e70151f65197d66ac9c405b00a2d8ff9b_1709626265.jpg,https://store.nintendo.co.kr/media/catalog/product/cache/8e3c84988db1fdb90470f4d01453d879/7/e/7ec50d1a40acfb02b9f6fa5c67d7d89e70151f65197d66ac9c405b00a2d8ff9b_1709626265.jpg,https://store.nintendo.co.kr/media/catalog/product/cache/8e3c84988db1fdb90470f4d01453d879/6/e/6ec477c74fd5207299cfda56aaf434f89f2975c0ca8c8877e5f935043b78e651_1709626265.jpg,https://store.nintendo.co.kr/media/catalog/product/cache/8e3c84988db1fdb90470f4d01453d879/d/7/d7297f5a4538bacb9845c89f18f69732367ebd4df72469a62583af1d9420fda0_1709626265.jpg","전략,퍼즐",switch
