title,url,date,imageurl,description,autokwd,company,screenshot,tag,platform
Berserk Boy,https://store.nintendo.co.kr/70010000068240,2024-03-07,https://store.nintendo.co.kr/media/catalog/product/cache/8e3c84988db1fdb90470f4d01453d879/d/2/d2290bd7a9b99072def5ca6e353331b4f6bcac92ddb521a0d5aaf95b4a398404_1706084198.jpg,"고 양성체가 되어라! Go Berserk! 번개, 불, 얼음, 바람, 그리고 대지의 힘을 사용하여 행성을 악한 Dr. Genos로부터 구해라!
멀리 머나먼 미래에서, 미친 과학자와 그의 어둠의 군대는 지구의 사람들을 노예로 만들려고 합니다. 모든 인류의 희망은 저항운동과 함께하지만, 그들로는 충분할까요? 케이, 신참 영웅이 나타나면서 이 신비로운 오브 에너지에 의해 '버서크 보이'로 변신합니다!

고속 액션과 악을 물리치는 능력을 지닌 버서크 보이는 악랄한 드. 제노스 박사와 그의 어둠 에너지 하수인들과 맞서야 합니다. 그는 세계를 구할 수 있을까요? 너무 늦기 전에 세계를 구할 수 있을까요? 이제 '버서크'를 가자!

버서크가 되어 속도와 기술의 달인이 되어 보세요. 버서크 미터를 채우고 파괴적인 특수 공격을 발동시키기 위해 콤보를 연결해 나가세요! 능력을 업그레이드하고 멈출 수 없는 힘을 획득하세요!

뉴 호프 시티와 그 이상으로 펼쳐지는 거대한 세계를 탐험하세요! 그 길에 따라 숨겨진 미션을 해제하세요. 여러 스테이지를 통해 점프, 대쉬, 날아다니며 숨겨진 수집품과 대체 경로를 발견하세요!

버서크 보이는 세련되고 세련된 플랫포밍 액션으로 레트로 게이밍을 현대로 가져옵니다. 장르의 거장들에서 영감을 받아 이 현대적인 어드벤처에서는 레트로한 느낌으로 큰 점수와 빠른 시간을 즐길 수 있습니다.

소닉 매니아 작곡가 티 로페즈에 의한 음악: TMNT 사운드 트랙, Streets of Rage 4, Metal Slug Tactics 등의 멋진 작품 뒤의 대가로 알려진 사운드 트랙으로 즐기세요! 세계를 구하면서 '버서크'하고 높은 에너지 비트를 즐기세요!","Berserk Boy,버서크 보이 ",BERSERKBOY GAMES,"https://store.nintendo.co.kr/media/catalog/product/cache/8e3c84988db1fdb90470f4d01453d879/d/2/d2290bd7a9b99072def5ca6e353331b4f6bcac92ddb521a0d5aaf95b4a398404_1706084198.jpg,https://store.nintendo.co.kr/media/catalog/product/cache/8e3c84988db1fdb90470f4d01453d879/d/2/d2290bd7a9b99072def5ca6e353331b4f6bcac92ddb521a0d5aaf95b4a398404_1706084198.jpg,https://store.nintendo.co.kr/media/catalog/product/cache/8e3c84988db1fdb90470f4d01453d879/7/1/71fa9012c3b01adbe3e94f0817b8069369f3aaa1f3ce8a2e85a0f49f8d35fda4_1706084198.jpeg,https://store.nintendo.co.kr/media/catalog/product/cache/8e3c84988db1fdb90470f4d01453d879/7/c/7cc1ab39c81701a8a01c97c8f74498dbb0cdce6c0f91634331fabd962b4f4afb_1706084198.jpg,https://store.nintendo.co.kr/media/catalog/product/cache/8e3c84988db1fdb90470f4d01453d879/9/b/9befe9bd621f164de3d92e1b53aa37760a28bafb70c876c639f97e7ff793227c_1706084198.jpg,https://store.nintendo.co.kr/media/catalog/product/cache/8e3c84988db1fdb90470f4d01453d879/c/1/c16957aca1091d7df6c94c19dd48bc18948130ef9b9683fe088fccaf190b56b5_1706084198.jpg,https://store.nintendo.co.kr/media/catalog/product/cache/8e3c84988db1fdb90470f4d01453d879/3/a/3aee5684b30047fef245cdbd419861bb437b4d13790aba74d9d7ca6e2b5e48e5_1706084198.jpg","액션,어드벤처,아케이드,격투",switch
Metal Mind,https://store.nintendo.co.kr/70010000072961,2024-03-07,https://store.nintendo.co.kr/media/catalog/product/cache/8e3c84988db1fdb90470f4d01453d879/d/f/df2893c0b71598768cdff4646d167228588f1b76a103b3e8fa8bfa720a3295b5_1709712842.jpg,"메탈 마인드는 로그라이트에 메카 모딩을 결합한 탑다운 슈팅 게임입니다.
인공지능의 배신: 자유 의지를 찾아서
정치인, 과학자, 엔지니어, 비밀 요원들로 구성된 조직인 AWC는 로봇이 스스로 의지를 가져서는 안 된다고 믿습니다. 그들은 전 세계의 로봇을 모아 지성을 박탈하고 노예로 만들기 위해 로봇을 모으기 시작했습니다. 플레이어는 각성한 로봇으로서 동족의 해방을 위해 저항의 여정을 시작하게 됩니다.

메카 변신: 나만의 궁극의 워 머신을 만들어 보세요
몸체, 코어, 액추에이터 부품에 100가지가 넘는 무기를 장착해 보세요. 열, 무기 회전 속도, 재사용 대기시간, 파워, 방어구 조각 등을 다양하게 수정하여 나만의 빌드를 만드세요. 내가 만든 작은 로봇을 치명적인 몬스터 무기로 바꿔보세요!

다양한 무기, 모든 총이 불타오릅니다!
어깨 대포? 전신 방어용 폭발 갑옷? 130mm 함포? 캣슈트까지... 상상할 수 있는 모든 것을 갖추고 있습니다(*￣3￣)╭

기계 역학 + 로그 라이크: 수많은 빌드
무작위 아이템 드랍, 무작위가 아닌 개조. 노력 없이 얻는 것은 없고 맹목적인 발전도 없습니다. 당신의 운명은 당신의 손에 달려 있으며, 과학이 당신의 힘을 향한 탐구를 안내합니다! 기억하세요: 모든 개조가 유익한 것은 아닙니다! (하지만 적어도 기계 역학에 대해 배울 수 있습니다)

오버로드에 저항하세요! 인퀴지터를 처치하세요!
고릴라, 두뇌, 폭격기... 로봇 사회의 ""감독자""에게 도전하고, ""사악한 사냥개""를 몰아내고, ""보안""을 뚫고 최후의 종교 재판관에게 치명타를 날려버리세요!",Metal Mind,2P Games,"https://store.nintendo.co.kr/media/catalog/product/cache/8e3c84988db1fdb90470f4d01453d879/d/f/df2893c0b71598768cdff4646d167228588f1b76a103b3e8fa8bfa720a3295b5_1709712842.jpg,https://store.nintendo.co.kr/media/catalog/product/cache/8e3c84988db1fdb90470f4d01453d879/d/f/df2893c0b71598768cdff4646d167228588f1b76a103b3e8fa8bfa720a3295b5_1709712842.jpg,https://store.nintendo.co.kr/media/catalog/product/cache/8e3c84988db1fdb90470f4d01453d879/2/9/298d8c44b25d215d00e70993d059bf2415a39bbe1fd7cd1bc5a0fa409462ca3a_1709712842.jpg,https://store.nintendo.co.kr/media/catalog/product/cache/8e3c84988db1fdb90470f4d01453d879/0/f/0f94e306879fb0aa2729d8e861828fd06e8f5c88400aef4b82130602629f2193_1709712842.jpg,https://store.nintendo.co.kr/media/catalog/product/cache/8e3c84988db1fdb90470f4d01453d879/1/5/154c35d53647cb468b8218fda58f7fb9dd8a78b885ee7de5e4529824e23c54ac_1709712842.jpg,https://store.nintendo.co.kr/media/catalog/product/cache/8e3c84988db1fdb90470f4d01453d879/2/e/2e1aa72b63246d0e5ef3b16950270d14f249ba438a08179a2501331b76621025_1709712842.jpg,https://store.nintendo.co.kr/media/catalog/product/cache/8e3c84988db1fdb90470f4d01453d879/7/9/797e7b26a0895846948911ce828f3e8c4ef3cf1f28db818189633305c18cd20e_1709712842.jpg","액션,어드벤처,슈팅",switch
Expeditions: A MudRunner Game,https://store.nintendo.co.kr/70010000069646,2024-03-05,https://store.nintendo.co.kr/media/catalog/product/cache/8e3c84988db1fdb90470f4d01453d879/0/2/02005b57469ed2742a139930e727a733c5ad15085d8a5375ee75c62ad207f31a_1708330452.jpg,"이 새로운 오프로드 어드벤처 게임과 함께 과학 탐사를 떠나세요!
가장 큰 보상이 있는 과학 탐사를 떠나 자연의 도전에 적응하고 미지의 땅의 수수께끼를 푸세요. 숨겨진 보물과 잊힌 유적이 가득한 건조한 사막과 바위투성이 숲, 가장 가파른 산까지 광활한 야생으로 떠나세요.

첨단 기술과 하이테크 도구를 사용하여 장애물을 극복하고, 위험한 길에서 다양한 전천후 차량을 운전하면서 연구 임무를 지휘하세요. 기지를 건설하고 관리하며, 차량에 드론이나 스캐너 같은 필수 가젯을 장비하여 야생에서 성공을 거두세요. 일류 전문가팀을 고용해서 현장에서의 기술을 향상하고, 새로운 탐사 가능성을 여세요.

● MudRunner 및 SnowRunner의 크리에이터가 만든 가장 발전된 물리 기반 오프로드 모험에서 새로운 장면을 경험하세요.
● 정찰기로 지형을 확인해서 일정을 현명하게 계획하고, 금속 탐지기와 카메라 드론을 사용해서 값진 장비의 은닉처를 찾으세요.
● 고정 장치를 설치해 힘든 경사를 오르거나 음향 측심기를 작동해서 수심을 측정하는 등 차량의 최첨단 가젯을 사용해 극한 지형의 지도를 만드세요.
● 연구 시설을 건설하고 전문가를 고용해서 야영지를 관리하면서 탐사 중 새로운 기술과 가능성을 해제하세요.",Expeditions: A MudRunner Game,Focus Entertainment,"https://store.nintendo.co.kr/media/catalog/product/cache/8e3c84988db1fdb90470f4d01453d879/0/2/02005b57469ed2742a139930e727a733c5ad15085d8a5375ee75c62ad207f31a_1708330452.jpg,https://store.nintendo.co.kr/media/catalog/product/cache/8e3c84988db1fdb90470f4d01453d879/0/2/02005b57469ed2742a139930e727a733c5ad15085d8a5375ee75c62ad207f31a_1708330452.jpg,https://store.nintendo.co.kr/media/catalog/product/cache/8e3c84988db1fdb90470f4d01453d879/7/0/70f3b7c1b7862c8b7b5b1451a93fedfbaabe5e06190b3e464d792b2f4de4e125_1708330452.jpeg,https://store.nintendo.co.kr/media/catalog/product/cache/8e3c84988db1fdb90470f4d01453d879/6/c/6ca1d3c04ee46086dccbe21ed832ce7f6856197050c41c53b18e016bad6523e7_1708330452.jpeg,https://store.nintendo.co.kr/media/catalog/product/cache/8e3c84988db1fdb90470f4d01453d879/f/f/ffea653dfebcb1c62416d5269fac3febb308e42b9151e60443d88ff5720f9ee3_1708330452.jpeg,https://store.nintendo.co.kr/media/catalog/product/cache/8e3c84988db1fdb90470f4d01453d879/8/5/85ec8aa3abadcc35308c3803f5fb81259ce4cd6731f4e38374bfa19667ee010b_1708330452.jpeg,https://store.nintendo.co.kr/media/catalog/product/cache/8e3c84988db1fdb90470f4d01453d879/d/f/df8d67f4a26910218236e6e9aa4f46b9f18cec0fb3ece1bb56f70c2b3b2e6f6b_1708330452.jpeg",시뮬레이션,switch
Cricket Through the Ages,https://store.nintendo.co.kr/70010000073117,2024-03-02,https://store.nintendo.co.kr/media/catalog/product/cache/8e3c84988db1fdb90470f4d01453d879/3/e/3e807e6b14ffd27fa5d94c1e0d9f4e7d8e338d51c6ce3cbdd4e9865240e03116_1708503322.jpg,"크리켓을 통해 구전되는 역사
오직 하나의 버튼만 사용하는, 물리 기반의 게임에서, 인류와 크리켓의 얽힌 역사를 통해 배트를 휘두르고 공을 던지세요. 수천여 년 전, 인류는 멸종의 위기에 다다랐습니다. 조상들은 지구의 거대생명체들에게 속수무책이었습니다. 그렇게하여... 인류를 구원한... 크리켓 게임이 발명되었습니다! 혼자서도, 친구와 함께라도, Cricket Through the Ages에서 크리켓이 함께한 세기에 걸친 인류의 멋진 역사를 만나보세요.",Cricket Through the Ages,Devolver Digital,"https://store.nintendo.co.kr/media/catalog/product/cache/8e3c84988db1fdb90470f4d01453d879/3/e/3e807e6b14ffd27fa5d94c1e0d9f4e7d8e338d51c6ce3cbdd4e9865240e03116_1708503322.jpg,https://store.nintendo.co.kr/media/catalog/product/cache/8e3c84988db1fdb90470f4d01453d879/3/e/3e807e6b14ffd27fa5d94c1e0d9f4e7d8e338d51c6ce3cbdd4e9865240e03116_1708503322.jpg,https://store.nintendo.co.kr/media/catalog/product/cache/8e3c84988db1fdb90470f4d01453d879/e/8/e874985c2a37dc92198e4496fac0e02bad498366dc45240fee9dbe9376af15d5_1708503322.jpg,https://store.nintendo.co.kr/media/catalog/product/cache/8e3c84988db1fdb90470f4d01453d879/b/c/bc376e992e75250e27bfbff90c516a9f2b0146b97e67c0aaeb0fd573693a1711_1708503322.jpg,https://store.nintendo.co.kr/media/catalog/product/cache/8e3c84988db1fdb90470f4d01453d879/7/2/7251dbb506c065b8e779ae6fde448546d72292c58e98274bddcd66a98a290025_1708503322.jpg,https://store.nintendo.co.kr/media/catalog/product/cache/8e3c84988db1fdb90470f4d01453d879/a/4/a4ea18dbecdc4f9e7966567498b16b62650dc861a29d19ea2b4126018b373fd9_1708503322.jpg,https://store.nintendo.co.kr/media/catalog/product/cache/8e3c84988db1fdb90470f4d01453d879/d/c/dca52217b887c5e1a1178e8e29cda16f2e86d41415914892da89e604438aaf1b_1708503322.jpg","스포츠,아케이드,기타",switch
Matches Puzzle 2: 클래식 로직 아케이드,https://store.nintendo.co.kr/70010000074936,2024-02-29,https://store.nintendo.co.kr/media/catalog/product/cache/8e3c84988db1fdb90470f4d01453d879/5/6/56ba09417ce5de1c2152ea9879891cf8a09da5e930036b4405817191ebc23ed6_1707940853.jpg,"성냥개비 퍼즐은 논리, 지능, 창의적 사고를 위한 실제 훈련입니다!
플레이어가 성냥을 이용해 다양한 문제를 해결해야 하는 흥미진진한 퍼즐 게임입니다.

게임의 규칙은 매우 간단합니다. 성냥을 이동, 제거, 추가하여 퍼즐을 풀어야 합니다. 이러한 문제는 특정 기하학적 도형을 만드는 것부터 수학 방정식을 푸는 것까지 매우 다양할 수 있습니다. 이 게임은 다양하고 흥미로운 퍼즐을 제공하며 각 퍼즐에는 창의성이 필요합니다.

이 게임은 모든 연령대의 사람들에게 적합하며 논리적 사고와 창의적인 문제 해결 능력 개발을 촉진합니다.

게임 특징:
• 마음과 논리를 위한 탁월한 훈련;
• 수많은 흥미로운 수수께끼;
• 즐거운 음악 반주;",Matches Puzzle 2: 클래식 로직 아케이드,Megame,"https://store.nintendo.co.kr/media/catalog/product/cache/8e3c84988db1fdb90470f4d01453d879/5/6/56ba09417ce5de1c2152ea9879891cf8a09da5e930036b4405817191ebc23ed6_1707940853.jpg,https://store.nintendo.co.kr/media/catalog/product/cache/8e3c84988db1fdb90470f4d01453d879/5/6/56ba09417ce5de1c2152ea9879891cf8a09da5e930036b4405817191ebc23ed6_1707940853.jpg,https://store.nintendo.co.kr/media/catalog/product/cache/8e3c84988db1fdb90470f4d01453d879/b/0/b094374234d2cec66bb18f128c25bde0547cf537c68999d7b46d3cec388e9c6f_1707940853.jpg,https://store.nintendo.co.kr/media/catalog/product/cache/8e3c84988db1fdb90470f4d01453d879/b/4/b488efc46c1c48b8bdc304932ffe0522ea44cce39e4f7c661a9676bf51c62fdd_1707940853.jpg,https://store.nintendo.co.kr/media/catalog/product/cache/8e3c84988db1fdb90470f4d01453d879/1/b/1b4a29b45157c44ce800d326502538ea8d0ddfef8a31e126f8d56e49e0cd5433_1707940853.jpg,https://store.nintendo.co.kr/media/catalog/product/cache/8e3c84988db1fdb90470f4d01453d879/5/d/5dd8ce355531d55bd02998ae295f767e91e1bbdb8999900cc37bd1615a901406_1707940853.jpg","퍼즐,보드,학습",switch
Helicopter Simulator : RESCUE SIM,https://store.nintendo.co.kr/70010000076699,2024-02-29,https://store.nintendo.co.kr/media/catalog/product/cache/8e3c84988db1fdb90470f4d01453d879/6/b/6ba5f080989aa2e58ffd8611d1becad44d377805c74a2f9859b55f9436904e72_1707984791.jpg,"파일럿 본능을 발휘해 섬의 하늘을 날아다니며 도전하고 임무를 완수하세요!
Helicopter Simulator : RESCUE SIM에서 아드레날린이 솟구치는 항공 임무의 세계를 경험하세요!

로터 블레이드 소리에 눈을 뜨고 스릴 넘치는 도전으로 가득한 하루를 준비하세요.
미지의 영역을 탐험하고, 헬리콥터의 갈고리로 정밀한 화물 배달을 수행하고, 지정된 구역에서 분실물을 찾는 등 다양한 임무를 수행하세요. 성공적으로 완료하면 게임 내 화폐 형태의 보상을 획득하여 헬리콥터를 업그레이드하고 연료를 구매하고 기지를 선택할 수 있습니다.
이 흥미진진한 게임에서 하늘의 영웅이 되어 파일럿 기술을 연마하세요!

주요 특징
* 흥미진진한 미션: 탐험과 수색부터 중요한 화물 배달까지.
* 현실적인 헬리콥터 컨트롤: 실제 파일럿이 된 기분을 느껴보세요.
* 오픈 월드: 광활한 바다와 섬을 탐험하세요.

헬리콥터 시뮬레이터에서 잊을 수 없는 모험을 준비하십시오: RESCUE SIM!",Helicopter Simulator : RESCUE SIM,SUCCESS GAMES,"https://store.nintendo.co.kr/media/catalog/product/cache/8e3c84988db1fdb90470f4d01453d879/6/b/6ba5f080989aa2e58ffd8611d1becad44d377805c74a2f9859b55f9436904e72_1707984791.jpg,https://store.nintendo.co.kr/media/catalog/product/cache/8e3c84988db1fdb90470f4d01453d879/6/b/6ba5f080989aa2e58ffd8611d1becad44d377805c74a2f9859b55f9436904e72_1707984791.jpg,https://store.nintendo.co.kr/media/catalog/product/cache/8e3c84988db1fdb90470f4d01453d879/8/9/89c55da8d7802595116f996c5e87f5f74646b4f8e4bbaeed23a338bc34f7a526_1707984791.jpeg,https://store.nintendo.co.kr/media/catalog/product/cache/8e3c84988db1fdb90470f4d01453d879/0/d/0d7a27b982bbf3d5ae362d18be8a5056f09ea00773196b43b3ee23ed3ab19270_1707984791.jpeg,https://store.nintendo.co.kr/media/catalog/product/cache/8e3c84988db1fdb90470f4d01453d879/8/9/89a59fbb9a305c479663b3bdc52ab270b47c0074931940454c5989e941079c59_1707984791.jpeg,https://store.nintendo.co.kr/media/catalog/product/cache/8e3c84988db1fdb90470f4d01453d879/6/2/6274964da2163e4cdb39964ea1c16f67638c7e38c651ae3417d52c0cf896880b_1707984791.jpeg,https://store.nintendo.co.kr/media/catalog/product/cache/8e3c84988db1fdb90470f4d01453d879/4/0/40d26fe6b6000adfef4e45f14984c0647167daa67bfb6e65439734dcdcd87c6d_1707984791.jpeg","어드벤처,아케이드,시뮬레이션,학습",switch
Crazy Goose Simulator,https://store.nintendo.co.kr/70010000077001,2024-02-29,https://store.nintendo.co.kr/media/catalog/product/cache/8e3c84988db1fdb90470f4d01453d879/7/3/73944c94a116b917be57cd091c07b8d0b1ee2416d42831381c285433941b3320_1708503333.jpg,"내면의 장난을 풀고 Crazy Goose가 되어 혼돈을 경험하세요! 기발한 환경을 돌아다니고, 인간에게 경적을 울리고, 혼란을 일으키세요. 퍼즐을 풀고, 성과를 얻고, 친구들과 경쟁하세요.
Crazy Goose가 되어 엉뚱한 여행을 떠나세요. 혼돈과 유쾌함에 대한 끝없는 욕구를 지닌 깃털달린 말썽꾼을 조종하세요. 고요한 시골과 기발한 환경을 자유롭게 돌아다니면서 내면의 소름끼치는 장난을 마음껏 펼칠 수 있습니다. 순진한 사람들에게 경적을 울리는 것부터 다양한 장소를 혼란에 빠뜨리는 것까지, 이 게임은 여러분을 당황하게 만들 독특하고 재미있는 경험을 제공합니다.
다양한 환경으로 가득 찬 역동적인 세계를 자유롭게 돌아보세요. 각각 고유한 도전 과제와 놀라움을 안고 있는 고요한 공원과 기발한 장소를 탐험해 보세요.
다양한 장난스러운 활동에 참여하고 재미있는 목표를 완수하세요. 아이템을 훔치는 것부터 아무것도 모르는 캐릭터에게 장난을 치는 것까지, 모든 행동이 혼란을 야기합니다.
게임의 역동적인 환경과 그 주민들과의 다양하고 재미있는 상호작용을 즐겨보세요. 다양한 시나리오를 통해 경적을 울리고 캐릭터가 재미있고 예측할 수 없는 방식으로 반응하는 것을 지켜보세요.
극복하려면 교활함과 창의력이 필요한 다양한 퍼즐과 도전에 직면하세요. 거위의 독창성을 사용하여 인간보다 한 수 앞서고, 새로운 영역을 잠금 해제하고, 숨겨진 비밀을 발견하세요.
소름끼치는 장난으로 기발한 업적을 달성하고 순위표에 올라보세요. 친구들과 경쟁하여 소름 끼치는 장난의 달인을 보여주세요.
""Crazy Goose Simulator""는 장난꾸러기 거위의 본질을 포착하는 깃털이 펄럭이고 경적을 울리는 모험을 약속합니다. 이 재미있고 독특한 시뮬레이션 게임으로 내면의 혼란을 불러일으킬 준비를 하세요!",Crazy Goose Simulator,DEZVOLT GAMES,"https://store.nintendo.co.kr/media/catalog/product/cache/8e3c84988db1fdb90470f4d01453d879/7/3/73944c94a116b917be57cd091c07b8d0b1ee2416d42831381c285433941b3320_1708503333.jpg,https://store.nintendo.co.kr/media/catalog/product/cache/8e3c84988db1fdb90470f4d01453d879/7/3/73944c94a116b917be57cd091c07b8d0b1ee2416d42831381c285433941b3320_1708503333.jpg,https://store.nintendo.co.kr/media/catalog/product/cache/8e3c84988db1fdb90470f4d01453d879/9/7/9791f88baae89e84ec2b44229b18027a121e040da468215db3e6886cc81c17c2_1708503333.jpg,https://store.nintendo.co.kr/media/catalog/product/cache/8e3c84988db1fdb90470f4d01453d879/1/f/1fa64b4eb313352bf0f9c214b77321dd89a4c1013dbfcb362bfa531a81740d70_1708503333.jpg,https://store.nintendo.co.kr/media/catalog/product/cache/8e3c84988db1fdb90470f4d01453d879/e/8/e866c96cd170757842d436f685f4172430193dd6b73953bdffdd665a565acc08_1708503333.jpg,https://store.nintendo.co.kr/media/catalog/product/cache/8e3c84988db1fdb90470f4d01453d879/e/d/ed56f914c7ac5abaa98f3ea663740e8120f902fe0b9667fd8ff86d999aad2f84_1708503333.jpg,https://store.nintendo.co.kr/media/catalog/product/cache/8e3c84988db1fdb90470f4d01453d879/1/7/17f70985b6f2267d235d7cc4be9fc0cee88b21399bcd3e8ae518f03a870340d3_1708503333.jpg","RPG,파티,전략,시뮬레이션",switch
Anglerfish,https://store.nintendo.co.kr/70010000074391,2024-02-29,https://store.nintendo.co.kr/media/catalog/product/cache/8e3c84988db1fdb90470f4d01453d879/4/b/4bbc7d1e006dd411ed352dfe1251889582a6b356c050518e1b21eabd5d655e8c_1709108049.jpg,"산탄총, 재치, 그리고 불안한 탐험을 위한 강한 배짱만으로 장대한 모험을 떠나세요. 게임은 죽을 때만 저장됩니다. Anglerfish에서 하룻밤을 보낼 수 있나요?
앵글러피쉬에 오신 것을 환영합니다. 몰스 산맥의 외딴 술집. 여기서 당신은 데이트의 진정한 생존 공포를 경험하게 될 것이며, 이는 당신이 죽을 것임을 의미합니다. 여러 번. 여러 번. 죽을 때마다 처음부터 다시 시작해야 하지만, 여기서 중요한 점은 어떻게, 어디서 죽었는지에 따라 게임이 바뀐다는 점입니다. 밤을 통과하려면 구석구석을 탐험하여 아귀의 심장 깊숙이 숨겨져 있는 비밀을 밝혀내고 숨겨진 수수께끼를 풀어야 합니다. 앵글러피쉬에서 가장 거친 밤을 살아남을 수 있을까요?

특징:
♡ 메멘토 모리 - 구할 수 있는 유일한 방법은 죽는 것입니다.
♡ 죽음이 우리를 갈라놓을 때까지 - 당신이 죽을 때마다 게임이 적응하여 새로운 것을 유지합니다.
♡ 아름다운 인생 - 산만 할 정도로 아름다운 픽셀 아트 그래픽.
♡ 뭐가 그렇게 웃겨? - 정신이 번쩍 들게 하거나 정반대의 효과를 주는 어두운 유머.
♡ 오, 슛 - 믿을 수 있는 산탄총으로 박진감 넘치는 생존 공포 게임 플레이를 경험하세요.
♡ 방금 읽은 내용은 모두 거짓인가요?
♡ 추가 언어: 덴마크어.","Anglerfish,아귀 ",Feardemic,"https://store.nintendo.co.kr/media/catalog/product/cache/8e3c84988db1fdb90470f4d01453d879/4/b/4bbc7d1e006dd411ed352dfe1251889582a6b356c050518e1b21eabd5d655e8c_1709108049.jpg,https://store.nintendo.co.kr/media/catalog/product/cache/8e3c84988db1fdb90470f4d01453d879/4/b/4bbc7d1e006dd411ed352dfe1251889582a6b356c050518e1b21eabd5d655e8c_1709108049.jpg,https://store.nintendo.co.kr/media/catalog/product/cache/8e3c84988db1fdb90470f4d01453d879/c/d/cd183100157c0064dd513a1ffa86c46df2308ca95e687e71f097a876c4e3ad45_1709108049.jpg,https://store.nintendo.co.kr/media/catalog/product/cache/8e3c84988db1fdb90470f4d01453d879/d/4/d41ed5abf595526617753954940018d8beba152140e1ee3de0a7d492704f8a4d_1709108049.jpg,https://store.nintendo.co.kr/media/catalog/product/cache/8e3c84988db1fdb90470f4d01453d879/5/5/559ec760c03512a653ae0f2fd6f8f0459c96e40696bb34d0123a95e6369aa229_1709108049.jpg,https://store.nintendo.co.kr/media/catalog/product/cache/8e3c84988db1fdb90470f4d01453d879/c/8/c81f21b0c2b9557b494b528e3680d212187ac76a19a7bba77911d24d98922da9_1709108049.jpg,https://store.nintendo.co.kr/media/catalog/product/cache/8e3c84988db1fdb90470f4d01453d879/0/4/042892f92577490bec1c2e29e22120d7f17f4f784d507f2265d0852bb4c89643_1709108049.jpg","액션,어드벤처,격투,퍼즐",switch
Matsukeke BURST!,https://store.nintendo.co.kr/70010000078336,2024-02-29,https://store.nintendo.co.kr/media/catalog/product/cache/8e3c84988db1fdb90470f4d01453d879/2/4/240228_matsukeke_burst_herobanner_e_1.jpg,"돌리고, 연결하고, 맞추기만 하면 된다!
간단한 규칙으로 신감각의 대전 낙하물 퍼즐.
패널에 그려진 선을 연결하여 크고 작은 루프를 만들어 지우는 신감각 낙하물 퍼즐입니다.
상대보다 빠르게 큰 루프를 만들어 파워를 모아 스킬을 발동하세요! 서로 패널을 보내며 승부를 겨룹니다.

총 세 명의 플레이어블 캐릭터가 등장하는 스토리 모드, 2인 대전, 거대한 루프와 대연쇄를 차근차근 만들어가는 스코어 어택 등 다양한 모드가 준비되어 있습니다.

게임 내 모든 일러스트 제작에 사용된 '유비사키 페인트'도 수록.
손가락이나 터치펜의 필압을 감지해 부드러운 선을 표현하고, 조이콘을 왼손 디바이스로 활용해 그림을 그릴 수 있다.
등장 캐릭터를 주제로 한 색칠공부와 샘플 필적 데이터가 수록되어 있습니다.",Matsukeke BURST!,SmileBoom,"https://store.nintendo.co.kr/media/catalog/product/cache/8e3c84988db1fdb90470f4d01453d879/2/4/240228_matsukeke_burst_herobanner_e_1.jpg,https://store.nintendo.co.kr/media/catalog/product/cache/8e3c84988db1fdb90470f4d01453d879/2/4/240228_matsukeke_burst_herobanner_e_1.jpg,https://store.nintendo.co.kr/media/catalog/product/cache/8e3c84988db1fdb90470f4d01453d879/2/4/240228_matsukeke_burst1_screen1_1.jpg,https://store.nintendo.co.kr/media/catalog/product/cache/8e3c84988db1fdb90470f4d01453d879/2/4/240228_matsukeke_burst2_screen2_e_1.jpg,https://store.nintendo.co.kr/media/catalog/product/cache/8e3c84988db1fdb90470f4d01453d879/2/4/240228_matsukeke_burst3_screen3_e_1.jpg,https://store.nintendo.co.kr/media/catalog/product/cache/8e3c84988db1fdb90470f4d01453d879/2/4/240228_matsukeke_burst4_screen4_1.jpg,https://store.nintendo.co.kr/media/catalog/product/cache/8e3c84988db1fdb90470f4d01453d879/2/4/240228_matsukeke_burst5_screen5_1.jpg","액션,어드벤처,퍼즐,기타",switch
