title,url,date,imageurl,description,autokwd,company,screenshot,tag,platform
Contra: Operation Galuga,https://store.nintendo.co.kr/70010000063983,2024-03-12,https://store.nintendo.co.kr/media/catalog/product/cache/8e3c84988db1fdb90470f4d01453d879/8/1/8157922adc16d2e4e21ac80a448716d7323ae5fb4292ef4d186ba146deb411d8_1708416752.jpg,"예약구입 상품입니다.
전설의 콘트라 솔저인 빌과 랜스가 돌아왔다!
리로드 & 리본
화려하게 나가보자구!!
콘트라 시리즈의 최신작이 드디어 등장!
본 작품은 1980년대 발매되 인기를 끌었던 초대 ""콘트라""의 완전 리메이크.
강화된 무기 시스템, 새로운 게임 플레이 메커니즘, 또한 새로운 적과 스테이지 등 게임 플레이를 현대적으로 업데이트.
리부트되어 확장된 『콘트라의 세계』에서 새로운 이야기가 펼쳐진다.
진정한 콘트라 레거시가 지금 시작한다!!

<스토리>
뉴질랜드 앞바다의 가르가 제도를 수수께끼의 테러리스트 집단인 ""레드 팔콘""이 점거했다.
이들은 섬을 요새화하고, 최종병기 개발을 진행중인 것으로 보인다.
이 사태에 지구 해병대는 전설의 슈퍼 솔져, 콘트라 부대의 빌 라이저와 랜스 빈을 출동시킨다.
거기서 그들을 기다리고 있었던 것은 상상을 초월한 지구 존망을 건 전쟁이었다.

<게임 개요>
쏘고, 달리고, 적을 날려버리고... 런앤건 게임의 재미가 더욱 진화!
횡 스크롤과 종 스크롤 스테이지가 있는 사이드뷰 런앤건 액션 게임.
다양한 무기를 활용해 8개 의 스테이지에서 기다리고 있는 적군과 각 필드보스를 격파하라!
간단한 조작성과 다양한 난이도 옵션으로 누구나도 즐길 수 있으며, 스토리 모드에서는 2인 협동 플레이, 아케이드 모드에서는 최대 4인까지 협동 플레이가능.

<모드 소개>
■ 스토리 모드
기존의 가르가 제도를 무대로, 새로운 캐릭터와 함께 새로운 이야기가 펼처진다.
섬의 최심부에서 빌과 랜스가 발견한 진실은 과연...?
2인 협동 플레이 가능.

■ 아케이드 모드
간편하게 게임 플레이를 즐길 수 있는 모드.
빌과 랜스 및 새롭게 추가된 플레이어블 캐릭터를 조종하여 실력을 증명해보자.
최대 4인 협동 플레이 가능.

■ 챌린지 모드
'타임 어택' , '무기 사용 제한'등 다양한 제약이 있는 미션도 도전이 가능하다.
미션을 성공하면 대량의 ""콘트라 코인""을 획득할 수 있다.

■ 특전 상점
각 모드에서 모은 ""콘트라 코인""으로, 캐릭터의 다양한 어빌리티와 얼터너티브 사운드 등을 획득할 수 있다.
알림
＝＝＝＝＝＝＝＝＝＝＝＝＝＝＝＝＝＝＝＝＝＝＝＝＝＝＝＝＝＝
Contra: Operation Galuga Early-purchase Bonus
＝＝＝＝＝＝＝＝＝＝＝＝＝＝＝＝＝＝＝＝＝＝＝＝＝＝＝＝＝＝
Contra: Operation Galuga 를 사전 구매한 플레이어는 보너스로 아래 아이템을 받을 수 있습니다.
・콘트라 코인x1000
콘트라 코인은 게임 내 숨겨진 요소를 해방하거나 보너스를 획득하는 데 사용할 수 있는 인게임 아이템입니다.
 
＝＝＝＝＝＝＝＝＝＝＝＝＝＝＝＝＝＝＝＝＝＝＝＝＝＝＝＝＝＝
Contra: Operation Galuga Demo
＝＝＝＝＝＝＝＝＝＝＝＝＝＝＝＝＝＝＝＝＝＝＝＝＝＝＝＝＝＝
정식 버전에는 ""스테이지 1"" 및 ""스테이지 3""의 일부가 포함되어 있습니다.
또한, 다양한 능력을 가지고 있는 아래 캐릭터를 플레이 가능합니다.
- 빌, 랜스, 아리아나, 프로보텍터
* 데모 버전을 완료한 세이브 파일이 있는 경우, 정식 버전 플레이 시 특별 보너스를 받을 수 있습니다.
* 데모 버전의 진행 상황을 정식 버전으로 이전할 수 없습니다.
* 데모 버전은 정식 버전과 일부 내용이 다를 수 있습니다.",Contra: Operation Galuga,KONAMI,"https://store.nintendo.co.kr/media/catalog/product/cache/8e3c84988db1fdb90470f4d01453d879/8/1/8157922adc16d2e4e21ac80a448716d7323ae5fb4292ef4d186ba146deb411d8_1708416752.jpg,https://store.nintendo.co.kr/media/catalog/product/cache/8e3c84988db1fdb90470f4d01453d879/8/1/8157922adc16d2e4e21ac80a448716d7323ae5fb4292ef4d186ba146deb411d8_1708416752.jpg,https://store.nintendo.co.kr/media/catalog/product/cache/8e3c84988db1fdb90470f4d01453d879/9/a/9aac3d6465b7613993367c55d612454a0af4bdf3ae3cb95bd1438a928928032e_1708416752.jpg,https://store.nintendo.co.kr/media/catalog/product/cache/8e3c84988db1fdb90470f4d01453d879/9/2/92afd9da59f30221817bcc93ab0dfc0314eb88999cf2d41120d764e2a385de3f_1708416752.jpg,https://store.nintendo.co.kr/media/catalog/product/cache/8e3c84988db1fdb90470f4d01453d879/1/1/1178e02d238f9eb7aa34930a5b47f0d96e8f1f697e5c5cdff0edfe2f0c05fafd_1708416752.jpg,https://store.nintendo.co.kr/media/catalog/product/cache/8e3c84988db1fdb90470f4d01453d879/7/8/783ea62973ddbd662f86441f005bb2c45e4defbef13c8b8d064427766372538c_1708416752.jpg,https://store.nintendo.co.kr/media/catalog/product/cache/8e3c84988db1fdb90470f4d01453d879/5/8/58f19df9d6da0f016fc29841689f1047b5dcbcf2d8cc4311f0bec28c7799e698_1708416752.jpg","액션,어드벤처,아케이드,슈팅",switch
Unicorn Overlord,https://store.nintendo.co.kr/70010000065197,2024-03-08,https://store.nintendo.co.kr/media/catalog/product/cache/8e3c84988db1fdb90470f4d01453d879/3/e/3e4a3aa351350e21e7fbb1c65698aab0cd4b37c6d62fc838952c62cfb8f6ae03_1694679105.jpg,"운명에 저항하는, 유대와 사랑의 환상 전기
ATLUS × VANILLAWARE가 도전하는 신생 시뮬레이션 RPG

망국의 왕자로 살아남아 해방군을 이끌게 된 당신은
거대한 악의 손아귀에 떨어진 세계를 해방하기 위해
일각수의 반지를 되찾고 백성을 지키기 위해 일어선다.

광대한 세계를 자유롭게 누비며 동료를 만나, 육성하고, 지휘하여
함께 각지를 해방해 나가는 새로운 감각의 시뮬레이션 RPG!

인간, 엘프, 수인, 천사 등 동료 캐릭터는 무려 60명 이상!
각기 다른 종족과 병종의 동료를 자유롭게 편성하여 싸워라!

온라인 투기장에서 랭킹 1위를 목표로 전 세계의 플레이어와 대전하라!
최강의 부대를 이루는 것은 바로 당신이다!

※본 상품이 포함된 세트 상품도 있습니다. 중복 구매에 주의하시기 바랍니다.","Unicorn Overlord,유니콘 오버로드",SEGA,"https://store.nintendo.co.kr/media/catalog/product/cache/8e3c84988db1fdb90470f4d01453d879/3/e/3e4a3aa351350e21e7fbb1c65698aab0cd4b37c6d62fc838952c62cfb8f6ae03_1694679105.jpg,https://store.nintendo.co.kr/media/catalog/product/cache/8e3c84988db1fdb90470f4d01453d879/3/e/3e4a3aa351350e21e7fbb1c65698aab0cd4b37c6d62fc838952c62cfb8f6ae03_1694679105.jpg,https://store.nintendo.co.kr/media/catalog/product/cache/8e3c84988db1fdb90470f4d01453d879/2/4/240108_1_switch___1__.jpg,https://store.nintendo.co.kr/media/catalog/product/cache/8e3c84988db1fdb90470f4d01453d879/2/4/240108_2_switch___2__.jpg,https://store.nintendo.co.kr/media/catalog/product/cache/8e3c84988db1fdb90470f4d01453d879/2/4/240108_3_switch___3__.jpg,https://store.nintendo.co.kr/media/catalog/product/cache/8e3c84988db1fdb90470f4d01453d879/2/4/240108_4_switch___4__.jpg,https://store.nintendo.co.kr/media/catalog/product/cache/8e3c84988db1fdb90470f4d01453d879/2/4/240108_5_switch___5__.jpg","RPG,전략,시뮬레이션",switch
Ancient Weapon Holly,https://store.nintendo.co.kr/70010000073015,2024-03-08,https://store.nintendo.co.kr/media/catalog/product/cache/8e3c84988db1fdb90470f4d01453d879/b/6/b63e5e0f1485081ce028d2e8bc77dec8ae8ecb32b2ec19b3dd671b4357c96a5c_1708503313.jpg,"수만년의 시간을 거쳐 잠에서 깨어난 초고대 무기 홀리. 인류에 대한 복수극은 여기서부터 시작된다.
인류 붕괴의 위험물로서 미궁 깊숙이 봉인된 인형 병기 홀리.
수천 년의 시간을 거쳐 부활하여 인간에 대한 복수를 맹세한다.

앗아간 힘의 원천인 제단을 지키며, 층을 가로막는 게이트를 파괴하고,
스테이지 클리어를 목표로 하는 긴장감 넘치는 로그라이크 액션 게임.
얻은 마석을 사용하여 홀리를 진화시키고 제단을 확장하여 전략을 깊게 해보자.

▼게임 설정
옛날, 인간이 아직 고도의 문명을 발전시키고 있을 때, 세계를 휩쓴 전쟁이 발생했다.

수많은 무기가 생산되는 가운데, 한 소녀의 모습을 한 자율형 무기가 완성되었다.
그 손은 채찍이 되어 땅을 가르고, 모든 건물을 베어 넘기고, 연이어 사람을 죽이는 붉은 눈의 소녀.

사람들은 소녀를 '홀리'라고 이름 지었고, 그 너무나도 강력한 힘을 두려워해 지하 깊숙이 봉인했다.

수만 년의 시간을 거쳐, 깊고 어두운 마법 유적의 바닥에서 잠에서 깨어난 홀리가 처음 느낀 것은,
인간에 대한 억제할 수 없는 원한의 감정뿐이었다.

""인간, 죽이겠다""

무기 기능은 저하되어, 땅이나 벽을 다소 파괴할 수만 있는, 갓 재생된 소녀.
홀리의 지상을 향한 복수극이 시작되었다.

▼특징
1. 긴장감 넘치는 전투.
2. 적을 함정에 유인하는 전략성.
3. 함정에 유인한 적을 묻어버리는 시원한 액션.
4. 홀리의 진화, 제단의 기능 해제를 통한 전략의 깊이.

▼긴장감 넘치는 전투
던전 내에서는, 한순간의 망설임이 목숨을 위협한다.
숨쉬기도 잊을 정도의 긴장된 전투가 당신을 기다리고 있다.
압도적인 강함을 가진 적과 맞서며, 한순간의 틈을 노리는, 그런 전략적인 배틀을 즐길 수 있다.

▼적을 함정에 유인하는 전략성
땅을 가르고, 적의 진로를 막는 것. 이것이 당신이 살아남을 길이다.
적의 움직임을 파악하고, 함정을 만들어, 일망타진하는 것.
그것이 이 게임에서 요구되는 전략성이다.
일방적인 전투가 아닌, 적의 행동을 파악하고, 앞을 예측하는 전략이 필요하다.

▼함정에 유인한 적을 묻어버리는 시원한 액션
적을 함정에 유인하고, 마지막은 자신의 손으로 묻어버린다.
그 순간의 시원함이, 이 게임의 최대 매력이다.

▼홀리를 진화, 제단의 기능 해제를 통한 전략의 깊이
적을 처치할 때마다, 강화 아이템이 손에 들어온다.
강화 아이템을 사용하여 홀리를 진화시키고, 제단의 기능을 해제하자!
당신은 전략이 더 깊어지는 것을 체험할 수 있다!
스킬 트리 형식으로 되어 있어, 당신의 전략에 따라 다양한 강화가 가능하다.",Ancient Weapon Holly,ACQUIRE,"https://store.nintendo.co.kr/media/catalog/product/cache/8e3c84988db1fdb90470f4d01453d879/b/6/b63e5e0f1485081ce028d2e8bc77dec8ae8ecb32b2ec19b3dd671b4357c96a5c_1708503313.jpg,https://store.nintendo.co.kr/media/catalog/product/cache/8e3c84988db1fdb90470f4d01453d879/b/6/b63e5e0f1485081ce028d2e8bc77dec8ae8ecb32b2ec19b3dd671b4357c96a5c_1708503313.jpg,https://store.nintendo.co.kr/media/catalog/product/cache/8e3c84988db1fdb90470f4d01453d879/c/c/ccc227cde18b34b7df684ba161c7ed171416dd389a1a9c293b0135aa8b7a08f2_1708503313.jpg,https://store.nintendo.co.kr/media/catalog/product/cache/8e3c84988db1fdb90470f4d01453d879/1/6/162cf442db81438cc4638ea0457f0c16f3487f34cc8ee2b4d05805de1d2bec9f_1708503313.jpg,https://store.nintendo.co.kr/media/catalog/product/cache/8e3c84988db1fdb90470f4d01453d879/b/f/bf16d30b67529de907be507d2fe70f22db7411b78875fb08d7e3a49eb7b4953d_1708503313.jpg,https://store.nintendo.co.kr/media/catalog/product/cache/8e3c84988db1fdb90470f4d01453d879/0/d/0df977b410c0b6b8d9e3e73b85c42022158ffc5eef946ff287b6c57d316a584a_1708503313.jpg","액션,전략",switch
Eldgear,https://store.nintendo.co.kr/70010000072485,2024-03-08,https://store.nintendo.co.kr/media/catalog/product/cache/8e3c84988db1fdb90470f4d01453d879/9/e/9efda5434668802b80b3d26c2c394910dd850406b30bb06ef22803475c5bad79_1709108025.jpg,"Eldia의 에이전트로서 고대 유적을 봉인하며 웅장한 모험을 살아보세요!
Eldgear는 환상적인 세계에서 벌어지는 전략적 전술 RPG입니다.

수백 개의 국가가 증가하여 혼잡한 아르제니아의 광활하고 미탐의 땅에서, 중세 시대를 뒤로하고 마법 문명의 시대로 들어가는 새로운 시대가 시작됩니다.

턴제 전투에서는 번개처럼 혼자 전진하거나 대지처럼 차분히 전진하는 자신만의 전략을 선택할 수 있습니다. 몰입감 있고 즐거운 픽셀 애니메이션은 전투 경험을 높이기 위해 진행됩니다.

군집에서 적들을 날려버리는 지역 공격, 잘 조율된 태그로 발동되는 결합된 공격, 그리고 EMA (임베딩 능력) 및 EXA (확장 능력)을 사용하세요! 강력한 타격이 초특별한 기술로 업그레이드됩니다.",Eldgear,KEMCO,"https://store.nintendo.co.kr/media/catalog/product/cache/8e3c84988db1fdb90470f4d01453d879/9/e/9efda5434668802b80b3d26c2c394910dd850406b30bb06ef22803475c5bad79_1709108025.jpg,https://store.nintendo.co.kr/media/catalog/product/cache/8e3c84988db1fdb90470f4d01453d879/9/e/9efda5434668802b80b3d26c2c394910dd850406b30bb06ef22803475c5bad79_1709108025.jpg,https://store.nintendo.co.kr/media/catalog/product/cache/8e3c84988db1fdb90470f4d01453d879/f/e/fe14c38f36e3da7aad9d1b39f6f32c17704b557324f5a2f236736ee555842dd6_1709108025.jpg,https://store.nintendo.co.kr/media/catalog/product/cache/8e3c84988db1fdb90470f4d01453d879/5/6/563fe39aef5e716175bb653963af45363ff39956ce754da1c01c3c7e78214e30_1709108025.jpg,https://store.nintendo.co.kr/media/catalog/product/cache/8e3c84988db1fdb90470f4d01453d879/5/6/5692bbb87be937e95ee8d6460ddd186de245d88a052d4ad871d1c4887bccfac8_1709108025.jpg,https://store.nintendo.co.kr/media/catalog/product/cache/8e3c84988db1fdb90470f4d01453d879/c/8/c8a9eba7623aee1cf2b617dd1a41f97e3869f4bd6b326be75020bff4b8505225_1709108025.jpg,https://store.nintendo.co.kr/media/catalog/product/cache/8e3c84988db1fdb90470f4d01453d879/f/3/f3ae0c6004d7f55b9f4b374521b34e17ba1d68b6b6f64c03f3bb002c49dea0d8_1709108025.jpg","RPG,어드벤처,전략,시뮬레이션",switch
빼앗긴 왕국,https://store.nintendo.co.kr/70010000067983,2024-03-08,https://store.nintendo.co.kr/media/catalog/product/cache/8e3c84988db1fdb90470f4d01453d879/8/c/8c23358c623675b3d6204de125919e9d89fc923cfb46189d24a0e52005f14827_1709109648.jpg,"턴제 전략 게임과 액션 RPG가 만난 던전 탐색형 전리품 획득 게임
빼앗긴 왕국은 액션 RPG 요소를 가미한 실시간 턴제 전략 던전 탐색 및 전리품 획득 게임입니다. 플레이어는 최대 6인의 영웅을 싱글 플레이 또는 온라인 협동 플레이로 조작하여 로우 폴리곤으로 구현된 판타지 세상을 탐험해나갈 수 있습니다.

빼앗긴 왕국의 혁신적인 턴제 전투 시스템은 모든 팀이 같은 턴에 한꺼번에 액션을 취하게 함으로써 Divinty: Original Sin과 같은 전략적 깊이와 빠른 페이스의 액션 RPG가 주는 스릴을 동시에 느낄 수 있게 하는 특징이 있습니다. 모든 전투는 참여한 플레이어의 수에 따라 스케일이 조정되므로 같은 플레이스루 내에서도 손쉽게 게임을 끈 후 다시 참여할 수 있습니다!

높은 자유도의 클래스 시스템을 지닌 빼앗긴 왕국에서 플레이어는 전통 RPG식 클래스를 생성할 수도 있고, 수백 개의 스킬 내에서 자유롭게 원하는 스킬을 골라 틀에서 벗어난 나만의 챔피언을 구성할 수도 있습니다. 마법을 사용하는 암살자, 서리에서 태어난 사제, 그림자와 결합한 나이트를 만들어보세요. 더 나아가 플레이 방식에 진정한 변화를 줄 전리품을 모으고 재구성해 나만의 빌드를 만들 수도 있습니다. 전설의 메이스인 영혼을 부수는 아바돈을 휘둘러 내가 무찌른 적을 해골 전사로 변신시켜 부릴 수도 있고, 나의 피를 대가로 바치면 더 큰 위력을 발휘하는 저주받은 검 블러드레터를 휘두를 수도 있습니다. 속성이 부여된 주사위를 굴리는 D&D라이크 이벤트는 내 캐릭터에 영구적인 효과를 주므로 나만의 캐릭터를 만듦에 있어 색다른 층위를 가미해줍니다. 앞에 닥쳐오는 사건을 해결하기 위해 끊임없이 매력적인 선택지를 제시하는 이 게임에서는 모든 상황이 가능합니다.

RPG의 가장 근원적인 매력을 간직하고 있는 빼앗긴 왕국에서, 플레이어는 지루한 사이드 퀘스트에 발목 잡히는 대신 전투에 임하고, 캐릭터를 만들고, 진행 방향과 캐릭터에 영향을 미치는 선택지 사이에서 결정을 내리며 시간을 보내게 될 것입니다. 각 전투가 끝난 후 스토리, 자원 수집, 보물의 방과 상점 중 한 가지 선택지를 골라 절차에 따라 생성되는 모험의 막바지에 등장하는 보스와 만날 때까지 나아가세요. 도전에 자신이 있는 플레이어라면 6가지 난이도 중 난이도를 높여가거나, 한 번 죽으면 그걸로 끝인 하드코어 모드를 선택해 모든 전투를 마지막인 것처럼 즐길 수도 있습니다.

또한, 기존 캠페인에서는 불가능했던 빌드를 혼합하고 조합할 수 있는 빠른 속도의 로그라이크 모드가 있습니다.

검과 마법으로 역사의 한 획을 그으세요. 명예와 영광을 위해 전투에서 떨쳐 일어나세요. 빼앗긴 왕국을 되찾으세요.
알림
이 소프트웨어에는 인터넷에 접속할 수 있는 환경과, Nintendo Switch Online 가입(유료)이 필요한 모드나 기능이 있습니다.",빼앗긴 왕국,Burst2Flame Games,"https://store.nintendo.co.kr/media/catalog/product/cache/8e3c84988db1fdb90470f4d01453d879/8/c/8c23358c623675b3d6204de125919e9d89fc923cfb46189d24a0e52005f14827_1709109648.jpg,https://store.nintendo.co.kr/media/catalog/product/cache/8e3c84988db1fdb90470f4d01453d879/8/c/8c23358c623675b3d6204de125919e9d89fc923cfb46189d24a0e52005f14827_1709109648.jpg,https://store.nintendo.co.kr/media/catalog/product/cache/8e3c84988db1fdb90470f4d01453d879/b/6/b6fb1e8ea5053237035f5556f90d248ae357a983df6325db7e1d43662981071b_1709109648.jpg,https://store.nintendo.co.kr/media/catalog/product/cache/8e3c84988db1fdb90470f4d01453d879/e/0/e0baa99e7b6e7bd608c6bf258e369cb0a85f76ef9c4d416d7b4f1b73032f1b47_1709109648.jpg,https://store.nintendo.co.kr/media/catalog/product/cache/8e3c84988db1fdb90470f4d01453d879/e/8/e84f64dc71ce0a60d3f2ce245a41ee088cfedb15e1119d5d328d6df3a702b357_1709109648.jpg,https://store.nintendo.co.kr/media/catalog/product/cache/8e3c84988db1fdb90470f4d01453d879/5/3/53f21b50e98f98a5c360a991b9b8e2cf91edf1c57d47d6e2e1fb6b86d7333395_1709109648.jpg,https://store.nintendo.co.kr/media/catalog/product/cache/8e3c84988db1fdb90470f4d01453d879/5/4/54f2bb3bfdcf1e05a264bc33ca06c20b81a408e2e7ddd6c78be8f0d2afde460f_1709109648.jpg","RPG,어드벤처,전략,보드",switch
Gunsmith Workshop Simulator,https://store.nintendo.co.kr/70010000077287,2024-03-07,https://store.nintendo.co.kr/media/catalog/product/cache/8e3c84988db1fdb90470f4d01453d879/9/0/902f77dfc6e1e6ac1f3cb4c15ee82131d9a5194b80d77d7e52c3efd75cb5c3f3_1707293594.jpg,"유산을 만들고, 열정과 정밀함으로 총기 제작을 마스터하기 위한 여정을 받아들이세요.
Gunsmith Workshop Simulator에서 노련한 총제작자의 여정을 시작하세요. 다양한 무기를 조립, 수정, 테스트할 수 있는 총기 맞춤화의 상세한 세계에 빠져보세요. 총신, 방아쇠, 개머리판, 스코프 등 다양한 구성품으로 기술을 연마하여 고객에게 이상적인 총기를 만들어보세요.
주요 특징들:
• 광범위한 총기 맞춤 설정: 사실적인 총기 및 구성 요소를 다양하게 활용하여 무기의 모든 측면을 맞춤 설정하세요. 성능, 정확성 및 미학을 최적화하기 위해 조합을 실험해 보십시오.
• 현실적인 조립 및 분해: 정확한 메커니즘을 통해 총기를 조립 및 분해하는 복잡한 과정을 경험해 보세요. 각 부품이 다양한 총 유형의 전반적인 기능에 어떻게 기여하는지 이해합니다.
• 작업장 관리: 자신만의 총포 제작 작업장을 만들고 관리하세요. 도구, 기계, 기술에 투자하여 역량을 확장하고 더 많은 고객을 유치하세요.
• 시험 사격장: 맞춤 제작 후 사격장으로 가서 성능을 평가하세요. 정확도, 반동, 손상 출력과 같은 요소를 평가합니다.
• 고객 주문 및 계약: 고유한 선호도를 가진 다양한 고객의 주문을 이행합니다. 계약을 완료하여 화폐와 평판을 얻고 새로운 기회와 도전 과제를 열어보세요.
• 사실적인 그래픽 및 애니메이션: 총기 세부 사항을 보여주는 고품질의 사실적인 그래픽을 즐겨보세요. 유체 애니메이션은 조립 및 분해 시퀀스를 생생하게 구현하여 총제작 과정과 관련된 복잡한 작업을 강조합니다.",Gunsmith Workshop Simulator,DEZVOLT GAMES,"https://store.nintendo.co.kr/media/catalog/product/cache/8e3c84988db1fdb90470f4d01453d879/9/0/902f77dfc6e1e6ac1f3cb4c15ee82131d9a5194b80d77d7e52c3efd75cb5c3f3_1707293594.jpg,https://store.nintendo.co.kr/media/catalog/product/cache/8e3c84988db1fdb90470f4d01453d879/9/0/902f77dfc6e1e6ac1f3cb4c15ee82131d9a5194b80d77d7e52c3efd75cb5c3f3_1707293594.jpg,https://store.nintendo.co.kr/media/catalog/product/cache/8e3c84988db1fdb90470f4d01453d879/a/0/a061064c02b3dac04fceb7f54572a8ddaabec1444cc96d47d594efc066f6e68a_1707293594.jpg,https://store.nintendo.co.kr/media/catalog/product/cache/8e3c84988db1fdb90470f4d01453d879/b/7/b759cc384f8da01a9693fa748a3c2849825720ccf47f8834b640d9851d3cda12_1707293594.jpg,https://store.nintendo.co.kr/media/catalog/product/cache/8e3c84988db1fdb90470f4d01453d879/4/c/4c4a1bd82cc7bd670f8146771426b74e3fa30f4da584efe1c8a015bfc3ccfa57_1707293594.jpg,https://store.nintendo.co.kr/media/catalog/product/cache/8e3c84988db1fdb90470f4d01453d879/c/4/c4dbc29faa8e73823a1e058278504457935f68ed538cc0b5fba8334844ddee97_1707293594.jpg,https://store.nintendo.co.kr/media/catalog/product/cache/8e3c84988db1fdb90470f4d01453d879/9/1/919446d12f0cb1776b02ad6f24a56e4e6cf2b73a97cee67ba109cc10b0bf8eef_1707293594.jpg","액션,스포츠,시뮬레이션,학습",switch
Bad Cat Sam Simulator,https://store.nintendo.co.kr/70010000076400,2024-03-07,https://store.nintendo.co.kr/media/catalog/product/cache/8e3c84988db1fdb90470f4d01453d879/b/e/beccc4bdb99ec7afd58dc8bd9cc25f8939f60a08f57b36841802ecd0213f9b95_1709109672.jpg,"집안의 대혼란을 추구하는 이 고양이와의 모험에서 혼돈과 장난을 받아들이고 진지한 샘을 완벽한 내면의 평화로 인도하세요.
진지한 샘이라는 이름의 고양이는 집이 정리되어 있고 모든 것이 제자리에 있을 때 매우 화가 납니다.
샘이 내면의 평화를 얻을 수 있도록 도와주세요. 게임의 주요 임무는 집 주민들의 삶을 망치는 것입니다. 고양이로 플레이하면 주변의 모든 것을 파괴해야 하며 집주인에게 잡히지 않아야 합니다. 즉흥적으로 행동하고 미리 움직임을 생각하십시오.
게임의 특징
16개 레벨(한 번에 모든 레벨을 통과할 수는 없을 것입니다).
다채로운 그래픽.
재미있는 장난입니다(모든 것을 생각해 내는 동안 여기서 머리가 부러졌습니다).
일부 레벨은 매우 어렵습니다(강함을 테스트해 보세요).
이 모든 것이 경쾌한 음악과 함께!",Bad Cat Sam Simulator,404 Games,"https://store.nintendo.co.kr/media/catalog/product/cache/8e3c84988db1fdb90470f4d01453d879/b/e/beccc4bdb99ec7afd58dc8bd9cc25f8939f60a08f57b36841802ecd0213f9b95_1709109672.jpg,https://store.nintendo.co.kr/media/catalog/product/cache/8e3c84988db1fdb90470f4d01453d879/b/e/beccc4bdb99ec7afd58dc8bd9cc25f8939f60a08f57b36841802ecd0213f9b95_1709109672.jpg,https://store.nintendo.co.kr/media/catalog/product/cache/8e3c84988db1fdb90470f4d01453d879/5/f/5f9c2a000ade85286a88fd3551b827371580c82f40acf98f821d0039dd99358c_1709109672.jpg,https://store.nintendo.co.kr/media/catalog/product/cache/8e3c84988db1fdb90470f4d01453d879/8/6/8636958bf56e2765cca69e6c19124053bea4398eede7f4c78a2bfbf34433c000_1709109672.jpg,https://store.nintendo.co.kr/media/catalog/product/cache/8e3c84988db1fdb90470f4d01453d879/6/b/6bd298c1b7757ba4476ae38d2ea30045a6169cbf26fdd37d0638ec3056d006f8_1709109672.jpg,https://store.nintendo.co.kr/media/catalog/product/cache/8e3c84988db1fdb90470f4d01453d879/0/2/02fefee8cc1c6b7bc6e5bb9f65871a8c981728ea1d35b309d5da2fdc93e6e4b6_1709109672.jpg,https://store.nintendo.co.kr/media/catalog/product/cache/8e3c84988db1fdb90470f4d01453d879/5/c/5ce3a143bd1bf9d5af00618f54c39fba2decd84abc14fe46d1ba31885699826a_1709109672.jpg","액션,어드벤처,파티,시뮬레이션",switch
